Paper ID,Title,Session,Session Division,Individual Division,Session SubDivision,Sumission Type,Title to Check,Session to Check,Abstract
2005-951,Media Coverage of Ghanaian Women in Pre- and Post-Kufuor Election Period,"ternational & Development Subdivision, Intercultural & Development Division Interactive Paper Session",Intercultural & Development Communication,,International & Development Communication,Paper,Media Coverage of Ghanaian Women in Pre- and Post-Kufuor Election Period,"International & Development Subdivision, Intercultural & Development Division Interactive Paper Session","Issues affecting Ghanaian women gained prominence in the 2000 presidential electioneering campaign, leading to the creation of various political structures to address them. These new structures are expected to affect the medias coverage of women and womens issues. An examination of the media in the pre- and post-Kufuor election period revealed that coverage of women has not changed. However, findings indicate that the media is creating a class structure with its coverage of women within the various social classes."
2005-1001,Militarized Femininity and the Nation: Mediating the Jessica Lynch Story,Women and the News,Feminist Scholarship,,,Paper,Militarized Femininity and the Nation: Mediating the Jessica Lynch Story,Women and the News,"American national media coverage of women and war must be situated within an investigation of the gendered politics of American military manpower, its relation to patriotism, patriarchy, Western progress and the gendered discourses adopted by the U.S. media to frame war as a (white) male endeavor. This project explores the way that the story of Jessica Lynch provides for a powerful space on which to map cultural and political narratives about gender and war. In tracing the symbolic and ideological use of the figure of the female soldier embodied by Jessica Lynch by national media discourses I propose that the female soldier becomes a sight for the constitution of a series of normative paradoxes, but also a point of entry for the debates about women and war. The story of Jessica Lynch is about contradictions to the core of normative narratives of war and gender. Indeed, the nations investment in Jessica Lynch is about the celebration of a potentially disruptive kind of femininity; it is about the celebration of an American female soldier. At the same time, the media interpreted the events surrounding Lynchs capture and rescue in such a way that would uphold masculinitys centrality to the war system by explicitly containing her militarized femininity."
2005-1051,News Cues: Do Indicators of Newsworthiness by Newsbots Affect our Perception of News Stories?,"Top Eight Papers in Communication and Technology, Part 1",Communication and Technology,,,Paper,News Cues: Do Indicators of Newsworthiness by Newsbots Affect our Perception of News Stories?,"Top Eight Papers in Communication and Technology, Part 1","Google News and other newsbots have automated the process of news selection, providing online users with a virtually limitless array of news and public information, dynamically culled from thousands of news organizations all over the world. News leads are typically accompanied by three cuesthe name of the primary source from which the headline and lead were borrowed, the time elapsed since the story broke, and the number of related articles written about this story by other news organizations tracked by the newsbot. This paper investigates the psychological significance of these cues by positing that each cue triggers a distinct heuristic (mental shortcut) that tends to influence online users perceptions of a given news item. A large 2x3x6 within-subjects online experiment (N = 523) systematically varied two levels of the source-credibility cue, three levels of the upload-recency cue and six levels of the number-of-related-articles cue in an effort to investigate their effects upon perceived message credibility, newsworthiness and likelihood of clicking on the news lead. Results showed evidence for source primacy effect, and some indication of a cue-cumulation effect when source credibility is low. Findings are discussed in the context of machine and bandwagon heuristics."
2005-1101,Organizational Media Selection and Use: A Comparison and Synthesis of Communicational Approaches,"Knowledge Management, Organizational Media, and Communication Technology",Communication and Technology,,,Paper,Organizational Media Selection and Use: A Comparison and Synthesis of Communicational Approaches,"Knowledge Management, Organizational Media, and Communication Technology","The goal of this paper is to compare and contrast how different organizational communication theorists/researchers would answer the question: Do organizational members choose the media they use? Specifically, four different lines of theory and associated research strategies on organizational communication and media are considered, namely, James Taylor and colleagues, Janet Fulk and colleagues, Noshir Contractor/Monge and colleagues, and Marshall Scott Pool and colleagues. The common themes and differences among these approaches and the implications for developing theory and research strategies to successfully investigate and explain media selection and usage within organizations are discussed."
2005-1151,Play it Again Uncle Sam: Ritual and Imagination in American Dreams,Hopes and Dreams and Imagined Themes,Popular Communication,,,Paper,Play it Again Uncle Sam: Ritual and Imagination in American Dreams,Hopes and Dreams and Imagined Themes,"This paper examines the television show American Dreams. Through semiotic, textual, and narrative analysis, paired with what producers have said about the show, I argue that the show serves a nation-building function. Set in Philadelphia in the 1960s, the show focuses on the six-member Pryor family, the audience is meant to see the family as their prior American selves. Meg, the eldest daughter embodies the future of the nation. Just as Meg is eager and forward-looking, with a face so smooth and glowing it couldnt be any easier to look at, the history presented on American Dreams is infinitely digestible, relating well-known events as simply as possible, inserting pop songs from the era into the narrative to orient viewers to the emotions they should be feeling, and making use of authentic news and television footage to add authenticity and a sense of realness to the stories that are told. American Dreams, by playing retro media, using the audiences knowledge of how it all ends, and sympathetically portraying multiple perspectives, imagines a nation unified by history and emotion. The retelling of history on American Dreams serves a nation-building function; it is a retelling of a shared past that revisits tensions only to resolve them, letting viewers imagine not only a better America, but also an America in which they are members. This show, which premiered a year after the terrorist attacks of September 11, offers support to the American public by suggesting that Americas current state of anxiety is natural and tolerable."
2005-1201,Privacy and Smart Cards: Hong Kong and Ontario,Theorizing Technologys Impact on Communication and Policy,Communication Law & Policy,,,Paper,Privacy and Smart Cards: Hong Kong and Ontario,Theorizing Technologys Impact on Communication and Policy,"This article examines the notion of privacy as it is conceptualized and implemented as a constitutive element of identity in two different milieux: Hong Kong (a Special Administrative Region of the Peoples Republic of China), and Ontario (Canada). We argue that in addition to institutional structures that differ between the two jurisdictions of Hong Kong and Ontario, differing cultural notions of privacy tend to affect the acceptance of new information and communication technologies (ICTs). For our comparison, we focus on one potentially privacy-invasive technology, smart cards, and discuss the factors that contribute to their adoption and use in the two regions selected, including ones conceptualization of digital identity and privacy, and the role of consultation and public debate."
2005-1251,"Redefining ""Local"" in Radio News: The Impact of Consolidation on Coverage","Profit, Convergence, Ownership: Corporate Issues in News Production",Mass Communication,Journalism Studies,,Paper,"Redefining ""Local"" in Radio News: The Impact of Consolidation on Coverage","Profit, Convergence, Ownership: Corporate Issues in News Production","Consolidation of ownership has been a defining characteristic in local radio, particularly since the Telecommunications Act of 1996. While changes in format consolidation and general programming have been well-documented, the implications for local radio news have not been studied as extensively. This paper utilizes data from field research in a small radio market to examine issues related to news values and decision-making when such choices are taken out of a local context. It compares the content of news produced in that local market to newscasts produced for that city from a corporate newsroom almost 300 miles away. Broader issues about the meaning of news in a community are also examined in the context of cultural geography and sense of place literature."
2005-1301,"Risk, Issues and Precaution in Late Modernity: Sustainable Public Relations on a Global Scale.",Public Health Crisis Response,Public Relations,,,Paper,"Risk, Issues and Precaution in Late Modernity: Sustainable Public Relations on a Global Scale.",Public Health Crisis Response,"Using the issue of climate change as an example, this paper aligns the public relations concept of issues management with the environmental management concept of risk. Both of these concepts advise a proactive approach. However, by drawing on Ulrich Becks concept of the risk society, we see that risks are discursively constructed and contested. At stake is the perception of legitimacy of risk or issue management strategies by stakeholders. Through analysis of submissions made to the New Zealand Government on climate change, we explore the utilisation of discourses by which companies and business associations in New Zealand attempt to influence public policy and legitimate their handling of the global risk."
2005-1351,Sex Versus Gender: Questioning the Dialogue,Theorizing the Feminine,Feminist Scholarship,,,Paper,Sex Versus Gender: Questioning the Dialogue,Theorizing the Feminine,"In teaching a course in Gender and Communication I became interested in understanding the complexities of the divide between what has been labeled sex and what we call gender. Following along with the textbooks, I gave the biological conceptualization of sex brief mention and quickly moved on to gender, the social and cultural constructions. Yet, I wanted to know more about the complexities of sex. How do we actually define sex? Why have we split sex from gender? In what ways are we better off from splitting the two concepts? In what ways have we suffered? Can we participate in the sex dialogue without oppressing women? Can we find ways to include communication scholars in the important dialogue of integrating sex and gende? With the introduction of biological and evolutionary perspectives of communication into our curriculum, I believe these are important questions to ask. I believe this pursuit of understanding the sex/gender divide will lead us toward the development of a progressive, integrative sex/gender communication theory and place communication scholars into a dialogue already in progress in multiple disciplines. In this paper, I explore the complexities of sex."
2005-1401,Still the Middle Way. A Study of Political Communication Practices in Swedish Election Campaigns.,Political Communication Around the World: Developing Models and Assessing Realities,Political Communication,,,Paper,Still the Middle Way. A Study of Political Communication Practices in Swedish Election Campaigns.,Political Communication Around the World: Developing Models and Assessing Realities,"This paper focuses on the process of hybridization of political campaigns, using Sweden as a case study, and raises three main research questions. Firstly, how do global campaign practices influence the national campaign context in Sweden? Secondly, how does Swedish political structure and political culture influence the adaptation of global trends in this area? Thirdly, how can a possible hybridization of political campaigning be characterized in Sweden?
The data in this study is mainly based on structured interviews with Party Secretaries and Campaign Officials in all seven parties with seats in the Swedish Parliament.
The results of the study indicate that the hybridization of political communication practices in Sweden is characterized by a growing use of global campaign practices. Marketing tools are frequently used for opinion analyses, but there are substantial obstacles for a complete implementation of modern practices. To some extent this can be explained by existing laws and regulations, but above all, by public perceptions of parties, politics and elections. Sweden is a country with a structural framework where global campaign features can be transformed to a large extent. However, a political culture more influenced by a national campaign context somewhat curtails this transformation process."
2005-1451,Television Activity Among African Americans: Is it Related to Perceptions of Outgroup Vitality?,cial Identity Processes in Intergroup Communication,Intergroup Communication,,,Paper,Television Activity Among African Americans: Is it Related to Perceptions of Outgroup Vitality?,Social Identity Processes in Intergroup Communication,"The present study continues the trend toward investigating the relationship between mass media and intergroup relations that has been developing over the last few years. Research and data have emerged, which indicate media use is related to ingroup perceptions of the intergroup context. However, little is known about the relationship between media and outgroups perceptions of the intergroup context. The current study attempts to advance this line of research by investigating the relationship between African Americans media activity and their perceptions of Caucasian and Hispanic vitality. Two hypotheses are offered based on Cultivation Theory, and a set of research questions are asked based on the Uses and Gratifications (U&G) approach. Results indicate the U&G approach is more robust than Cultivation Theory in predicting African Americans vitality perceptions of Caucasian and Hispanic vitality."
2005-1501,The Construction of Work in Online Career Sites of Fortune 500 Companies,Anticipatory Socialization and Recruitment,Organizational Communication,,,Paper,The Construction of Work in Online Career Sites of Fortune 500 Companies,Anticipatory Socialization and Recruitment,"Corporate recruitment efforts have evolved from traditional newspaper want ads to highly-sophisticated, rhetorically powerful recruiting Web sites or career sites. Career sites represent a unique aspect of organizational communication because they capture not only an organizations persuasive attempts to recruit potential applicants, but also contemporary beliefs about meanings of work. Using quantitative and qualitative content analysis of randomly selected Web sites from the 2004 Fortune 500 list, the authors found that most Fortune 500 companies focus on content that introduces the company and its positions, and attempts to sell the company as an employer. The persuasive movements employed on career sites include sketching the companys values, objectives, and credentials, building a case for the company as an employer of choice, sampling the workplace, and enabling the job search and application process. The representations of work displayed on career sites depict work as career-building, workers as agents, and employers as benefactors. These representations are critiqued in context of current reports on working conditions as well as Marxist critical theory."
2005-1551,The Emotional Life of the News: a Mediational Perspective on News Consumption and its Relevance for Political Communication,formation Processing: How We Come to Understand the World Around Us,Political Communication,,,Paper,The Emotional Life of the News: a Mediational Perspective on News Consumption and its Relevance for Political Communication,Information Processing: How We Come to Understand the World Around Us,"This paper examines a somewhat neglected  yet central  aspect of news consumption, that of emotions. Although the news is one of the most studied television genres, most traditional approaches rarely depart significantly from an  often unwitting  normative view (Schudson, 2000: 194). The paper is based on the premise that audiences engagement (or disengagement) with the news and politics involves both rational and affective elements. Drawing on original ethnographic work with British audiences the paper explores the emotional dimension of news consumption and discusses how it is relevant in the wider processes of engagement and participation in public life. The paper explores feelings and themes such as addiction, reassurance, shame, anxiety, pride, ambivalence, disappointment and anger and observes how audiences, through the news, connect (or not) to the wider narratives that have become the fabric of our world. The paper points to the power of the news and how much it is taken for granted even by those who are critical towards its content. Crucially, the paper has argued that the affective dimension of news consumption can cast light on the wider process of citizens engagement with politics and public life. News as a narrative is the means through which people connect to the world. But also, for some informants news has been a source of disappointment and anger and a catalyst for withdrawal from public life."
2005-1601,The Israeli Peace Movement as framed by the NYTimes (1984-2002),Covering Conflict and Peace,Intercultural & Development Communication,,International & Development Communication,Paper,The Israeli Peace Movement as framed by the NYTimes (1984-2002),Covering Conflict and Peace,"This essay investigates the New York Times framing of the Israeli peace movement between the years 1984-2002. The purpose of this research is to determine how the Israeli peace movement has been covered in the US press, and in so doing, to gain a clearer understanding of the complex relationship between movements and media over time and, more specifically, the types and effectiveness of the frames utilized by both sides in order to explain the complicated peace process in the Middle East to American readers. The results that emerged from the study suggest that the Israeli peace movement has successfully managed to legitimate itself as a mainstream force in press coverage of the region and has carved out a niche for itself as a reliable source of information on illegal settlements in the Occupied Territories, which provides it with an expert entry point within media coverage of the peace process. Study results also suggest that the peace movement has regularly been framed as on the verge of collapse and whose existence and struggles are evidence of the deep divisions within Israeli society. As a result, many newspaper articles negatively framed peace movement efforts as futile and contributing to dangerous polarizations in Israel. Often, however, many of the articles depicting these internal tensions, placed blame on the Palestinians for failing to negotiate in good faith or curtail violence. In this sense, the Israeli peace movement was regularly framed as victims of Palestinian betrayals of their misguided hopes for peace."
2005-1651,The Portrayals of Minority Characters in Entertaining Animated Children's Programs,Popular Communication Interactive Paper Session,Popular Communication,,,Paper,The Portrayals of Minority Characters in Entertaining Animated Children's Programs,Popular Communication Interactive Paper Session,"The purpose of this study is to note, categorize, and discuss the stereotypes of African Americans in animated childrens cartoons. The purpose is also to compare them to see how they changed.
A quantitative analysis of 76 cartoons found that The Proud Family, a cartoon of the 21st century, is more stereotypical than Fat Albert and the Cosby Kids, a cartoon from 30 years ago. Characters in Fat Albert are most often aggressive, intelligent, and witty. Characters in The Proud Family are most often jovial, aggressive, and intelligent. Though primary characters display the same amount of stereotypical behavior, secondary characters show an increase in the amount of stereotypical behavior.
This study extends the amount of research in the entertainment media field by focusing upon animated childrens cartoons. This approach will add to our understanding of stereotypes and the manner in which they are presented to audiences."
2005-1701,The Sequencing of Two Communication Models within Change: An Empirical Comparison of Two Organizations,Communication and Organizational Change,Organizational Communication,,,Paper,The Sequencing of Two Communication Models within Change: An Empirical Comparison of Two Organizations,Communication and Organizational Change,"The on-going and unremitting nature of new product development, shifting consumer and stakeholder priorities, and government reform create intense pressure for public sector organizations to commercialize, and for private sector organizations to be flexible (Zorn, Page & Cheney, 2000). Whilst most change processes are based on Lewins (1952) unfreeze-change-refreeze concept, the pressure faced by the public and private sectors to change continuously renders the Lewinian three step change models obsolete as time to refreeze is a rare commodity. This study investigates the communicative processes of change to address the identified knowledge gap in understanding the role, import and effect of communication in a continuous change environment. Using data from two longitudinal empirical studies, we extend Van de Ven and Pooles (1995) typology of change theories to accommodate the sequencing of two change communication models; monologic and dialogic change communication. The findings suggest that the sequencing of the two change communication models is informed by individual competencies and group expectations. Future research must consider the issues associated with sustaining and embedding of the communicative sequences in organizational change in order to avoid organizations being reliant on exceptional managers."
2005-1751,Towards Conceptualizing Suspension of Disbelief for Communication Research,Mass Communication High Density Session,Mass Communication,,,Paper,Towards Conceptualizing Suspension of Disbelief for Communication Research,Mass Communication High Density Session,"Suspension of disbelief is widely understood to be the tolerance of media users towards unreal or implausible content in fictional media. Although this concept and the phenomena behind it have been generally accepted, there is no precise definition of the corresponding activities of media users which could be utilized in order to test the construct empirically. Having introduced Suspension of Disbelief on the basis of its historical use as a nonmediation phenomenon and taking into account research on perceived reality and considerations about the distinction between reality and fiction Suspension of Disbelief is defined as a mode of media usage during which the recipient does not scrutinize plot consistency and realism of fiction media content nor does he or she pay attention to corresponding fractions and violations. Finally, the relevance of Suspension of Disbelief for research in communication science will be discussed."
2005-1801,"Using a Feminist Human Rights Framework to analyze HIV/AIDS, Communication and the Uighur Minority in China",Questioning Development Discourse,Intercultural & Development Communication,,International & Development Communication,Paper,"Using a Feminist Human Rights Framework to analyze HIV/AIDS, Communication and the Uighur Minority in China",Questioning Development Discourse,"This paper provides an analysis of the current HIV/AIDS situation among the Uighur ethnic minority in Xinjiang province. In order to better understand this issue, this paper will document the wider HIV/AIDS situation in China, paying particular attention to the ways in which China has been criticized by the international community for its treatment of the epidemic. A human rights framework allows for a careful analysis of the epidemic which takes into account the disproportionate way that HIV/AIDS affects marginalized groups around the world, and in the Xinjiang context as one which overwhelmingly affects the Uighur minority. Further, a feminist-inspired human rights framework provides an entry into gender-specific analyses of the epidemic. In a human rights approach to HIV/AIDS programming communication is understood to be both a right and a means to claiming other rights. As free communication is limited in totalitarian China, a human rights approach would open spaces within which communication would be possible, while paying particular attention to the gendered realities of HIV/AIDS."
