paper id,year,paper type,paper title,author number,abstract,session title,sub unit
2014-0000,2014,Paper Session,Against Policy Failure: Designing a Media System That Enables “The Good Life”,1,"Any conception of the “good life” would likely include a media system founded on normative values like openness, diversity, and information rich. Enabling freedom of speech and other essential liberties, this system would need to be accessible and affordable to all members of society. However, commercialized media systems often run counter to these ideals. American digital communication systems have become dominated by oligopolies driven by a corporate libertarian logic—one that conflated individual freedoms with corporate privilege—that does not accommodate public interest principles in line with “good life” ideals.","Extended Session: Communication Law, Policy, and the ""Good Life""",Communication Law & Policy
2014-0001,2014,Paper Session,Access to Knowledge and Cultivating the Good Life,1,"The Access to Knowledge [A2K] movement encompasses a broad theoretical, political and activist landscape that is concerned with the use of information and creative works outside the realm of intellectual property [IP]. A core principle of A2K is that the expansion of IP law is often anti-democratic, restrictive and an outright threat to cultural participation and creative practice. Restricting sharing, openness and access to information can prove a direct threat to “the good life” as imagined in an information society. In this position paper, I provide an overview of the problem of emerging IP enforcement regimes and explain how A2K approaches to information policy can cultivate social well-being.","Extended Session: Communication Law, Policy, and the ""Good Life""",Communication Law & Policy
2014-0002,2014,Paper Session,Digital Human Capital: A Policy Framework for Transitioning From Digital Exclusion to a “Good Life”,3,"***This proposal is for the Communication Policy & Law extended session on ""The Good Life"" conference theme***

This position paper argues for policymakers to implement a Digital Human Capital framework for designing ICT programs. This approach would help move marginalized community members into mainstream society through computer literacy initiatives that also address social exclusion. It has the potential to shift digitally excluded residents from a life on the periphery to, ideally, a “good life” with professional and educational opportunities.","Extended Session: Communication Law, Policy, and the ""Good Life""",Communication Law & Policy
2014-0003,2014,Paper Session,The Goods Life: Local Journalism From Public Good to Merit Good,1,"This position paper contributes to the discussion of how to ensure the sustainability of journalism by arguing for a rhetorical and semantic shift away from labeling journalism as a “public good” to thinking about it as a “merit good” (Musgrave, 1959). While public goods suggest regulatory intervention only to the point that “respect[s] the wishes of consumers,” merit goods suggest regulatory intervention regardless of consumption habits (Eecke, 1998, p.5). That is to say that merit goods are deemed so socially valuable that they should be provided regardless of consumer behavior. Positioning journalism as a merit good, rather than a public good lends political economic leverage for increased regulatory and legislative support for journalism, and may revive efforts to ensure the sustainability of journalism, particularly at the local level.","Extended Session: Communication Law, Policy, and the ""Good Life""",Communication Law & Policy
2014-0004,2014,Paper Session,The Right to Communicate as a Foundation for the Good Life,1,"This position paper argues that communication is a basic human right, and therefore a fundamental aspect of the good life. Accordingly, the right to communicate should be formally codified in international human rights law. Human rights are international norms that protect each human being from an array of abuses and seek to identify basic needs necessary to lead a minimally good life. Human rights are a “realistic utopia” in that they institutionalize the utopian ideal of a just society in the laws of modern constitutional democracies (Habermas, 2010). These rights exist as ideal statements that may be embodied in laws and regulations at local, national, or international levels. The Universal Declaration of Human Rights (United Nations, 1948) and other treaties serve as standards which identify norms to be embodied. In this regard, communication laws and policies can help to structure the good life within communities.","Extended Session: Communication Law, Policy, and the ""Good Life""",Communication Law & Policy
2014-0005,2014,Paper Session,Freedom of Information Laws and the Promise of “the Good Life”,1,"This paper discusses the contribution of freedom of information legislation for ""the good life"" as a tool that empowers citizen participation and makes governments more transparent.It focuses on the challenges of FOI legislation implementation in new democracies emphasizing structural barriers. It also identifies ways in which scholarship can help overcome those challenges.","Extended Session: Communication Law, Policy, and the ""Good Life""",Communication Law & Policy
2014-0006,2014,Paper Session,Good Life and Regulating Hate Speech Online,1,"The ICA 2014 conference them, “the good life”, can be read as a normative claim that suggests laws, regulations, and policy directions in the communication field ought to be consistent with and contributory to the goal of attaining well-being for individuals and communities. This position paper, thus, asks if tolerating hate speech in the online communication environment can be justified in the light of the good life; and what challenges and considerations ought to be discussed among communication and legal scholars.","Extended Session: Communication Law, Policy, and the ""Good Life""",Communication Law & Policy
2014-0007,2014,Paper Session,Position Paper: Revenge Porn: Criminalizing the Posting of Provocative Pictures When Breakups Go Bad,1,"Position Paper:

Position Paper – Communication Law & Policy and “the good life”
Revenge Porn: Criminalizing the Posting of Provocative Pictures When Breakups Go Bad

It has been dubbed “involuntary porn.” A couple breaks up and one of the parties posts once-intimate nude photos of the other all over the internet – sometimes including identifying information such as the subject’s name and address.
Hurtful and humiliating, yes. But should such cruel conduct be criminalized? That’s the law on the books now in California and New Jersey, while other jurisdictions consider outlawing “revenge porn” in the digital age.","Extended Session: Communication Law, Policy, and the ""Good Life""",Communication Law & Policy
2014-0008,2014,Paper Session,The Good Life: Privacy is Freedom,1,New legislation has the ability to provide individuals with the opportunity to control who collects and maintains their information. In this way the laws offer people the ability to again be free when using the Internet.,"Extended Session: Communication Law, Policy, and the ""Good Life""",Communication Law & Policy
2014-0009,2014,Paper Session,Contexts of Digital Surveillance and Trust: Ethical Action and the Good Life,1,"Ethical and legal charges about digital invasions of privacy usually surface in response to some apparent surveillance. Nissenbaum (2010) claims that privacy can be understood within a structure of “contextual integrity” in which streams of personal data, originating in different social contexts, are handled by entrenched socio-legal conventions. These conventions may be violated by the monitoring practices associated with information technologies; thus contextual integrity is broken. Privacy violations, then, are judged in accordance with the goals and values of a specific context. This research proposes a contextual reading of surveillance as it pertains to Nissenbaum’s contexts of privacy and the notion of contextual integrity and ethics. Specifically, it examines principles of “the good life” in terms of ethical responsibilities in legal remedies for privacy violations. In what contexts do we expect surveillance? How do “caring” forms of surveillance modify our perceptions of privacy rights? What technological routines support surveillance? What are the implications for human dignity and respect? How have current legal regimes surrounding privacy neglected basic notions of humanity that contribute to “the good life”? Using a critical theoretical perspective, this paper seeks to understand what surveillance contexts mean for individuals in terms of values, the law, and morality.","Extended Session: Communication Law, Policy, and the ""Good Life""",Communication Law & Policy
2014-0010,2014,Paper Session,Available Resources as an Indicator of Brand Placement Processing,6,"The present study applies the limited capacity model of motivated mediated message processing (LC4MP) to persuasive communication. Specifically, it aims to investigate whether and how (1) a brand logo placement in a video clip affects cognitive processing resources, and (2) the measurement of available resources with STRT reflects message elaboration. In a between-subjects experiment, 69 students were shown a video clip including brand placements with varying prominence. STRTs were measured immediately after the placement during the clip, and cognitive and affective processing measures were assessed after the clip. Analyses showed faster STRTs for prominent placements compared to nonprominent placements, and faster STRTs for nonprominent compared to no placement. This pattern indicated that with increasing logo prominence, message recipients had more resources available. The measured resources mirrored the cognitive and affective measures of message elaboration, indicating that brand logo prominence affects message elaboration, and that elaboration can be validly assessed through STRTs.",Cognitive Resource Allocation,Information Systems
2014-0011,2014,Paper Session,Beyond Time and Frequency: Attending to Attention in Media Multitasking,5,"The purpose of this study is to extend assessment of media multitasking to situations that involve more than two activities and to introduce attention as an additional outcome variable to time and frequency measures of media multitasking. Both frequency and attention measures supported the hypothesis drawn from limited capacity. Two-group multitasking activities were pursued more frequently than three-group multitasking activities and activities with TV/Video in the mix were pursued more frequently than activities without TV/Video in the mix. Further, attention allotted to the primary task decreased with increasing number of activities in the multitasking mix. The sharpest decline in attention to the primary task occurred when the number of activities increased from two to three. Overall, these findings suggest that time, frequency and attention are a triumvirate of variables that should be considered in concert when measuring multitasking.",Cognitive Resource Allocation,Information Systems
2014-0012,2014,Paper Session,Can Exemplars Trigger a Spiral of Silence?,3,"Research on exemplification has shown that exemplars can affect people’s perceptions of public opinion. More specifically, the distribution of exemplars, that is the proportion of individuals expressing a certain opinion, influences the way people perceive current opinion distributions in society. Climate of opinion perception is also an integral part of Noelle-Neumann’s spiral of silence theory which posits that people will fear to become socially isolated when they express opinions on morally loaded issues which contradict public opinion. They will therefore refrain from expressing such opinions in public. The current experimental study links research on exemplars and the spiral of silence by testing the effects of exemplar distributions on individual public opinion perception, fear of isolation, and the tendency to speak out. As a stimulus an online discussion group on Facebook was presented where we manipulated user comments regarding the issue of evicting violent immigrants.",Cognitive Resource Allocation,Information Systems
2014-0013,2014,Paper Session,Effects of Testimonial and Informational Comments on News Perception,2,"Online reader comments (ORCs) are located in close spatial proximity to the online news stories eliciting them. Previous studies have found that such ORCs can affect perception of news stories or issues discussed in them. The purpose of the current study is to build on this growing pool of literature on ORCs by examining how two types of ORCs found on health news websites, testimonial and informational, affect readers’ perceptions of credibility, newsworthiness, quality and liking of the professional health news content. The study will also investigate the possible moderating role of issue involvement. Petty’s Elaboration Likelihood Model will provide the theoretical framework for the study.",Cognitive Resource Allocation,Information Systems
2014-0014,2014,Paper Session,Engaging Readers: What Makes Readers Actively Seek More Information During Controversial Message Processing,5,"This study tests (1) the direct effects of personal traits, like need for cognition, open-mindedness, and issue interests, on information seeking behavior, and (2)whether the effects of these personal traits are contingent on characteristics of the issue context in which information seeking takes place. We use the emerging science of nanotechnology as a case study because, despite low levels of awareness (Smith et al., 2011), previous research has found that strongly held values and other types of heuristic cues are used by individuals to form opinions about the issue even in the absence of issue-related knowledge (Brossard et al., 2009). This work finds significant direct effects and interaction effects of personal traits and issue-interest factors on information seeking processes. Implications for the theoretical understanding of information processing of controversial science issues are discussed.",Cognitive Resource Allocation,Information Systems
2014-0015,2014,Paper Session,Exploring Effects of Controlled and Automatic Processes for Cognitive Information Processing on Perceived Interactivity,3,"The limited capacity model of motivated mediated message processing (LC4MP) could offer an explanation for the automatic process of how an audience reacts to online interactive elements. The other explanation will be the audience’s intention for future use of the website.
RQ1: How does intention affect users’ perceived level of interactivity of the website?
H1: When exposed to self-relevant interactive features that are in-line with their intention, appetitive activation will be enacted, and memory span will be higher than when the users are exposed to other neutral stimuli.
RQ2: How are controlled and automatic processes for cognitive information processing taking place in the presence of different interactive elements?
The participants will be randomly assigned to a 3 (intention: exploratory vs. information-seeking for self vs. information-seeking to help others) x 3 (motivational state: appetitive vs. aversive vs. control) between-subjects design. The dependent variables are attention and, perceived interactivity.",Cognitive Resource Allocation,Information Systems
2014-0016,2014,Paper Session,Information-Seeking as a Precaution Behavior: Exploring the Role of Decision-Making Stages,4,"The Planned Risk Information Seeking Model (PRISM) was employed to explain people’s information seeking intentions in the context of hydraulic fracturing. The stages from the Precaution Adoption Process Model were included in the analysis as a moderator. The PRISM fit the data well. Moreover, the results showed overall model differences among people who have not decided to take action about hydraulic fracturing, people who have decided to take action, and people who have decided not to take action. Findings provide justifications for tailored messages to encourage information seeking among the varying public.",Cognitive Resource Allocation,Information Systems
2014-0017,2014,Paper Session,"Resources Available to Processing Antismoking PSAs as a Function of Smoking Cues, Argument Strength, and Structural Complexity",1,"The current study examines how cognitive resources are allocated and required to processing audio and video information of antismoking PSAs, as function of three message characteristics: the argument strength (AS) of messages, the presence of smoking cues, and the structural complexity. By conceptualizing the three variables in terms of resources required and resources allocated, this study predicts resources available to processing antismoking PSAs by employing Secondary Reaction Time Measures accompanied by audio and video recognition. This abstract reported preliminary result supporting that strong argument elicit more resource allocated and smoking cues have impact on both resource allocation and the amount of resources required to process. Further, the result also suggests that structural complexity should be considered to explore available resources influenced by various message’s features.",Cognitive Resource Allocation,Information Systems
2014-0018,2014,Paper Session,"GIFTS: Communication, Gender, and Theory: Exploring the “Good Life” of One’s Childhood",1,"Through this activity, students recognize and relate communication and gender theories to real life scenarios. By applying their own childhood experiences, students engage directly with gender and communication theories. Moreover, when students apply these course concepts to their own childhood memories, their individual voices and perspectives enter the conversation. This activity encourages students to be active learners and critical thinkers in the classroom. After discussing which theories students perceive impacted their childhood memories, the teacher should poll the students to see which theories resonated with them the most. Even though gender is a culturally based construct, students often do not perceive it as having an impression on their gender construction. Rather than the teacher imposing this message directly, the results of this activity provide students with the opportunity to assess to what extent gender is a perceived cultural concept in their interpretations about gender and their own identity construction.",GIFTS: Great Ideas for Teaching Students,Instructional & Developmental Communication
2014-0019,2014,Paper Session,GIFTS: Describing the Network of Your Favorite Characters,1,This purpose of this activity is to introduce network analysis such that students are able to identify network roles and describe uses of network analysis in organizations.,GIFTS: Great Ideas for Teaching Students,Instructional & Developmental Communication
2014-0020,2014,Paper Session,GIFTS: Group Impromptu Speech,1,The purpose of this assignment is to give students experience with impromptu speaking in settings where additional information can be provided to the speaker(Business meetings/presentations). It also prepares students to add to their own ideas or concepts when asked on the spot.,GIFTS: Great Ideas for Teaching Students,Instructional & Developmental Communication
2014-0021,2014,Paper Session,GIFTS: Intercultural Transmedia Storytelling,1,"“Intercultural Transmedia Storytelling” is a bold, engaging concept, which helps multilingual, multicultural students, coming from different educational systems, assessment and learning styles, find fresh, fun methods to develop their awareness of story, exposition, and the respective power of sound and image and their ability to communicate their ideas. Based on intercultural and media components, the content is adaptable and the structure is flexible enough that it can be easily adapted (in its entirety or by using individual components) to different circumstances, for workshops or courses and different age groups. The key components include harnessing the power of sound and the visual in conveying story, combining the components in various media and individual and group basic storyboarding and transmedia storyboarding exercises. “Presentation assessments” throughout allow the “storyteller” to understand the audience perspective as well in adapting content, format and style.",GIFTS: Great Ideas for Teaching Students,Instructional & Developmental Communication
2014-0022,2014,Paper Session,GIFTS: Internet-Based Audience Awareness Activity,1,"This critical thinking activity was created for an online upper-division course taken by communication and writing majors. However, the activity could be used in any online or face-to-face course dealing with persuasion and reader/audience awareness. This activity helps students learn to tailor communication to a specific audience. After the activity, students are able to:

* Dissect an organization’s self-published documents to extract paradigms, priorities, and preferences.

* Predict whether a particular organization would likely accept a planned proposal.

* Defend their predictions with linguistic evidence found in the organization’s documents.

This activity allows online teachers to comment on student opinions conversationally and in front of the whole group, as is so often done in a face-to-face classroom. This activity encourages students to use the Internet to search for specific information, make a decision about that information, and find supporting evidence to justify that decision to others.",GIFTS: Great Ideas for Teaching Students,Instructional & Developmental Communication
2014-0023,2014,Paper Session,GIFTS: Nonverbal Speech Delivery and Humor: Discovering the “Good Side of Your Face”,1,"This activity addresses the need for students to develop nonverbal delivery skills and improve their proficiency in critical thinking. First, it introduces students to the seven nonverbal behavioral categories of speech delivery. Class discussion is facilitated through the application of these ideas to popular television sitcoms. Because the students watch the video first without any sound, they are given the opportunity to critique the speaker’s performance of nonverbal cues. Once they listen to the speaker’s message with his/her nonverbal behavior, students determine to what extent the speaker’s nonverbal behavior is effective. By opting to focus solely on the nonverbal cues first, this activity connects a speaker’s core message to the nonverbal behavior he/she demonstrates. Students evaluate and critique the speaker’s nonverbal cues. Ultimately, the activity motivates students to learn more about enhancing their own speech delivery by constructively evaluating speech deliveries on sitcoms.",GIFTS: Great Ideas for Teaching Students,Instructional & Developmental Communication
2014-0024,2014,Paper Session,GIFTS: Student Communication Theory Class Poster Presentations,1,"This Great Idea for Teaching Students (GIFTS) presents an activity used in a Communication Theory undergraduate course. Learning goals/objectives, a full description of the activity, and an evaluation with a grading rubric are covered.",GIFTS: Great Ideas for Teaching Students,Instructional & Developmental Communication
2014-0025,2014,Paper Session,"GIFTS: Teaching Research Traditions, Methods, and Research in Intercultural Communication",1,"The overarching goal is for students to understand the major research traditions in intercultural communication (social scientific, interpretive, and critical) and gain exposure to real research in intercultural communication. The specific objective is for students to be able to recognize the correct research tradition, method, and implication(s) of the research topic by analyzing a set of research articles in a group setting.",GIFTS: Great Ideas for Teaching Students,Instructional & Developmental Communication
2014-0026,2014,Paper Session,GIFTS: Teaching and Practicing Nonverbal Communication in Online Communication Courses,2,"Having taught business communication as an asynchronous online course for several years, I’ve consistently struggled with two issues:
1. How to encourage interaction among students (the literature recommends discussion boards, but students typically only post the required amount of times)
2. How to allow students to practice nonverbal communication skills
This discussion board activity, where students upload self-photographs in which they attempt to convey very specific emotions through their facial expressions, has addressed both issues.",GIFTS: Great Ideas for Teaching Students,Instructional & Developmental Communication
