paper id,year,paper type,paper title,author number,abstract,session title,sub unit
2014-0071,2014,Paper Session,How Camera Changes Affect the Recognition of Public Service Announcements: A Test Outside the Lab,2,"This study aimed at estimating the impact of camera changes on the recognition of PSAs amidst of an array of other factors affecting the attention to these ads. Recognition percentages of 193 PSAs derived from campaign evaluation studies were related to content analysis data of the ads measuring the number of camera changes per second and the information introduced per camera change. The study reveals increasing the number of camera changes may slightly increase PSA recognition if the amount of information introduced by these camera changes is small, but increasing the number of camera changes tends to decrease PSA recognition substantially as the amount of information introduced by these camera changes increases. Combined, the number of camera changes per second and the information introduced per camera change account for 5% of the variance in PSA recognition. These findings corroborate theoretical propositions from the LC4MP outside the laboratory setting.",Analyses of Content and Structural Features of Messages,Information Systems
2014-0072,2014,Paper Session,How Perceived Information Quality of Online News Sources Determines Political Knowledge Through Self-Efficacy,1,"The Internet is a challenging news source. Young users have to choose between so-called ‘quality media’ and diverse semi-professional or non-professional sources. We suggest that the perceived information quality of online news sources plays a crucial role in the acquisition of political knowledge. Based on self-efficacy theory (Bandura, 1977, 1986) we propose that in the course of an individual’s media socialization, perceived information quality, media self-efficacy, internal political efficacy, and political knowledge should be understood as consecutively linked.
Based on a student sample (N = 560), aged 12 to 22 (M = 16.04, SD = 1.37), our assumptions were supported for general online news exposure. Further, we examined whether the model holds true for professional, semi-professional and non-professional information sources. Here a more complex picture revealed. The results underline the importance of focusing on media literacy education as well as the development of media and internal political efficacy to trigger knowledge acquisition processes.",Analyses of Content and Structural Features of Messages,Information Systems
2014-0073,2014,Paper Session,"People vs. Objects in Media Texts: Effects of Content Features on Attention, Arousal, and Memory",4,"This study will test the effects of media content about either agentic subjects or inanimate objects on experimental participants’ attention, arousal, and memory. The study uses a 2 (topic: person v. object) x 2 (gender: male v. female) x 4 (repetition) mixed design. The dependent variables include heart rate (as a measure of attention), skin conductance (as a measure of arousal), and encoding, storage and retrieval (measured via recognition, cued recall, and free recall). The study will also investigate whether and how gender (operationalized for simplicity as a male-female dichotomy) moderates the hypothesized relationships between variables.",Analyses of Content and Structural Features of Messages,Information Systems
2014-0074,2014,Paper Session,The Impact of Image Intensity and Text Color on Responses to Health Warnings,8,"Health messages from organizations are often designed to communicate the risks of unhealthy behavior in explicit warning messages. Despite these efforts, graphic and fear-inducing health warnings have been considered to potentially trigger extreme fear and defensive reactions, such as message rejection or avoidance (i.e. Ruiter, 2005). To confirm this with real-time reactions, this study will investigate how the emotional intensity of visual images and color of text used in health warning messages impacts cognitive and emotional processing of the message in a 3 (Visual Image Intensity) X 2 (Text Color) X 3 (Message) X 3 (Order) within subjects repeated measures design. Participants will view health messages that vary along three levels of visual image intensity (low, moderate, and high) and two text colors (blue and red) while psychophysiological measures of cognitive resources allocated to encoding and emotional response are recorded. The research will also assess message attitudes and perceived effectiveness.",Analyses of Content and Structural Features of Messages,Information Systems
2014-0075,2014,Paper Session,Variables Influencing the Likelihood of Being Reminded to a Failed Message by a Similar Communication Situation,1,"This study investigated factors that influence whether a speaker will be reminded by a current communication situation to an earlier situation where a message addressing a similar primary goal had a negative outcome. Being reminded as such may play a role in the acquisition of increasingly sophisticated adaptive ability. The study asked whether the likelihood of being reminded to an “old” situation by an analogous “new” situation is influenced by: (a) four types of similarity between the two scenarios; (b) amount of elaboration on the old scenario; (c) number of times the old scenario was thought about; and (d) extent to which the earlier episode was interesting or emotional. Results showed that participants were reminded to more old situations when they elaborated on the old situations than when not, and when the old situations were processed twice, rather than once. The situation components most predictive of reminding varied across situations.",Analyses of Content and Structural Features of Messages,Information Systems
2014-0076,2014,Paper Session,“Help! I’m Being Attacked by a Giant Word!” Bodily Responses to Looming Words and Pictures,6,"This paper uses dynamic human centered communication systems theory (DHCCST) to make and test predictions about differential processing of words and pictures. In general, pictures and words did show different motivational activation responses across the time course. Pictures showed greater motivational activation, while words showed lesser activation initially but showed a second firing response that generally increased motivational activation. This supported these theoretical predictions. Movement as it relates to the imminence of threats and opportunities in our environments was also investigated, but results did not follow predicted lines. Implications and future research are discussed.",Analyses of Content and Structural Features of Messages,Information Systems
2014-0077,2014,Paper Session,Emotional Cues and Thought Confidence in Persuasion: Attitudinal and Behavioral Outcomes,2,"Substantial work has examined persuasion using the Elaboration Likelihood Model which examines the dual routes. Recent revisions of the model suggest that thought confidence can serve as a mediator for persuasion by affecting attitude change. The present study sought to replicate and expand the previous work done on thought confidence by looking at thought confidence’s effect on behavioral intention. Participants were exposed to brief strong or weak ads advocating donations to animal shelters accompanied by happy or sad music and photos. Replicating prior research, thought confidence mediated attitude change. In addition, thought confidence was also found to mediate the relationship between posttest attitudes and behavioral intention. Furthermore, the emotional frame manipulation replicated past work finding that the happy condition led to increased thought confidence. Finally, analysis of message bias showed an effect of emotional frame such that sad-framed messages were seen as more biased which led to decreased posttest attitudes.","Persuasion, Compliance, and Attitude Change",Information Systems
2014-0078,2014,Paper Session,Exploring the Cognitive Mechanism for the “Just-One-More” Technique of Gaining Compliance,1,"This paper reports an additional test of a new compliance-gaining technique called the “just-one-more” (JOM) technique that increases compliance rates by including the phrase “I just need one more person to help” (Carpenter, 2012). A study is reported (N = 160) tested the hypothesis that goal difficulty moderates the technique’s effectiveness in a 2 (JOM or direct request) X 2 (requester needs 5 surveys or 100). Results indicate that the JOM was substantially more effective than a direct request in the 100 surveys condition but not the 5.","Persuasion, Compliance, and Attitude Change",Information Systems
2014-0079,2014,Paper Session,Is Personalization Too Fragile to Work? How Priming and Need for Uniqueness Influence the Effectiveness of Personalized Communication,2,"Personalized communication is becoming an industry trend due to rapid development of Internet technologies. A personalized message is believed to be more efficacious than a non-personalized message because it creates a match between the message and the message receipt. The current study challenges this widely-accepted notion by arguing that personalization may not always outperform non-personalization since the effectiveness of a personalized message can be affected by both external factors (e.g., the context where the message is placed) and internal factors (e.g., the message recipient’s personality). Through a 2 (message type: personalized vs. non-personalized) × 2 (prime type: positive vs. negative) × 2 (need for uniqueness: high vs. low) between-subjects experiment with 223 adults, it is illustrated that a personalized message is more effective than a non-personalized one only when the immediate message context suggests so (when the prime is positive), and such a phenomenon is especially characteristic of individuals with a lower need for uniqueness. Theoretical and practical implications based on these findings are discussed.","Persuasion, Compliance, and Attitude Change",Information Systems
2014-0080,2014,Paper Session,Killer Ads: A Terror Management Account of Fear in Advertisements,4,"Building on terror management theory, three experiments tested whether advertisements with a mortality reminder increase purchase intentions for products that provide an (un)important source of self-esteem. Study 1 used a 2 (mortality reminder: yes vs. no) design for art library and newspaper subscriptions. Study 2 used a 2 (mortality reminder: yes vs. no) x 2 (brand familiarity: low vs. high) design for newspaper subscriptions. Study 3 used a 2 (mortality reminder: yes vs. no) x 2 (product type: healthy vs. unhealthy) design for a beverage with importance of the product for consumers’ self-esteem as a continuous moderator. Across studies advertisements with a death reminder increased unconscious thoughts about death, which, in turn, increased purchase intentions. These effects occurred independent of mood, brand familiarity, product type, product relevance to self-esteem, and ad liking. Findings suggest that ’killer ads’ trigger unconscious consumer fears that may be alleviated by the urge to buy.","Persuasion, Compliance, and Attitude Change",Information Systems
2014-0081,2014,Paper Session,Mere Thought Effects as Mere Bunk: Message Conformity Effects That Implode the Myth of Self-Generated Attitude Change,1,"An experiment was conducted to debunk the revered axiom from social psychology that people self-generate attitude change. Using the mere thought protocol, the study found that message conformity effects explain 350% more variance in attitudes than the traditional account of consistency-induced persuasion. The message conformity effects were predicted by the discrepancy propositions of information processing theory. Participants at a large eastern university (N = 232) were randomly assigned to receive the mere thought induction or a distraction task in a pretest-posttest control group design. Topic familiarity was also manipulated in the design. Regression analyses indicated that receivers’ perceptions of their referent group’s attitude toward the target concept, combined with their premessage attitude toward the target concept predicted attitude change. Causal modeling was used to track the effect of target attitudes on the rest of the attitude hierarchy.","Persuasion, Compliance, and Attitude Change",Information Systems
2014-0082,2014,Paper Session,Testing the Reactance vs. the Reciprocity of Politeness Explanations for the Effectiveness of the “But You Are Free” Compliance-Gaining Technique,2,"The “but you are free” (BYAF) technique of gaining compliance was designed to increase compliance by reducing reactance aroused by the request. This study collected data in France (N = 372) and the US (N = 240) to test a 3 (direct request, polite request, or BYAF) X 2 (requester benefits or 3rd party group benefits) design. The study was designed to offer a critical test of the reactance and the reciprocal politeness explanations of the technique. The French sample replicated the effectiveness of the technique and was consistent with the reactance explanation. The American sample did not replicate the technique but found an increase in compliance for the polite request, but only when the requester was the beneficiary. Possible explanations for the discrepant findings are discussed.","Persuasion, Compliance, and Attitude Change",Information Systems
2014-0083,2014,Paper Session,When Truth Hurts: How Rectifying Misinformation Can Lead to Unintended Consequences,2,"Once people have been confronted with a piece of information, it is hard to erase it—even if it turns out that the information was incorrect. In the worst case, the attempt to rectify misinformation can lead to solidification, resulting in even more people remembering the misinformation as true. So far, this so called backfire effect has been found in the context of health statement. In the present study, we transfer this phenomenon to the media environment and can show that misremembering myths as facts also occurs when misinformation is presented within an interview. Furthermore, we identify two moderators that amplify the backfire effect: The repetition of the myths before its rectification and the judgment formation strategy. Furthermore, results show that this flaw in memory also has consequences for people’s attitudes.","Persuasion, Compliance, and Attitude Change",Information Systems
2014-0084,2014,Paper Session,'Gender as a Multilayered Issue in Journalism': A Qualitative Study of Gender Inequality in Newsrooms,2,"The numerical inequality between male and female journalists is increasingly eliminated. However, the field of journalism remains divided along gender lines. Female journalists are underrepresented in older age groups and in media sectors, news areas and positions that are associated with high levels of prestige. The goal of our research was to study whether and how female journalists experience gender-related obstacles in their professional life. We examined this by means of in-depth interviews with 19 female journalists in Flanders (Belgium). The analysis confirms the existence of all ‘traditional’ barriers that women experience in journalism. The added value of this study is that we registered several additional difficulties, and that we gained insight into the strategies that our respondents use to deal with these gender-related barriers, and prevent them from having a negative impact on their job satisfaction (support of a partner, part-time or freelance work, use of digital technology, …).",Feminist Scholarship Interactive Poster Session,In Event: International Communication Association Annual Awards and Presidential Address
2014-0085,2014,Paper Session,Is the Personal Political (Yet)? Female Columnists in the US and the Male Definition of Politics,3,"Within a theoretical framework of feminist ethics, this study examines if and how female columnists in 10 prominent U.S. newspapers might express feminist politics in the typically male editorial pages. A discourse analysis of 312 columns penned by women shows that only a tenth of the articles covered, addressed or articulated issues from a feminist standpoint, usually matters of gender equality. Further inquiry into the authors’ experiences and perspectives as columnists revealed these women distance themselves from feminism and reject the notion of female topics.",Feminist Scholarship Interactive Poster Session,In Event: International Communication Association Annual Awards and Presidential Address
2014-0086,2014,Paper Session,Text to Sex: How Cell Phones Impact Hooking Up and Sexuality on Campus,1,"By centering attention on how students feel after casual sexual encounters, studies of the college social scene have missed an extremely important phenomenon – how hookups get started. My paper argues that it is in the negotiation of this contact via the cell phone that students creatively negotiate their sexual identity. Based on my own research (interviews, focus groups, and surveys) at an American liberal arts college, I discuss how students, in extensively texting for sex, experience a disconnect between their subversive behavior in hookups and their hegemonic explanations of campus sexual culture. Drawing on two divergent models of mediated self – Turkle’s “collaborative self” (2011) and Bauman’s egocentric consumer self (2003) – I explore how and why the mobile phone allows men and women to play with gender boundaries. Applying a feminist critique to texting for sex, I evaluate the impact of these revolutionary sexual subjectivities within a highly dominant fraternity culture.",Feminist Scholarship Interactive Poster Session,In Event: International Communication Association Annual Awards and Presidential Address
2014-0087,2014,Paper Session,Trans-ing the Wreck: Constructing a Trans Hip-Hop (Post) Feminist Lens,1,"This essay employs the recent Mr. Cee hip-hop scandal to construct what I coin a ""trans hip-hop (post) feminist lens."" By putting trans studies, postfeminism, and hip-hop feminism in conversation, I seek to develop a “functional feminism” that enables a greater exploration and substantiation of the potentials of feminism and hip-hop to tackle issues concerning black sexual politics, bourgeois respectability, and heteronormative patriarchy. I also seek to offer a more nuanced discussion of the complex, often contradictory nature of contemporary hip-hop.",Feminist Scholarship Interactive Poster Session,In Event: International Communication Association Annual Awards and Presidential Address
2014-0088,2014,Paper Session,Alcohol-Discordancy and HIV/AIDS Among Women in Rural Kenya,1,"Women in sub-Saharan Africa account for more than half (58%) of people living with the HIV and it is the only continent where HIV prevalence is higher for women than for men. Studies have attributed alcoholism is associated with the high rates of HIV/AIDS due to its impact on sexual behavior and arousal, and on the immune system. Based on the Protection Motivation Theory, this study explores perceptions on risk factors and vulnerabilities for HIV infection among women in in alcohol-discordant marital relationships. Data were gathered through focus groups in rural Central Kenya alcoholism has been declared an epidemic mostly impacting men of reproductive age (15-65). Emerging themes indicate reproductive health problems among male consumers that leave women with sexual and reproduction needs and women engage in risky behaviors to meet those needs. In spite of high risk perception women have low response efficacy.",Feminist Scholarship Interactive Poster Session,In Event: International Communication Association Annual Awards and Presidential Address
2014-0089,2014,Paper Session,Measurement of Preference for Homophily: A Grounded Research Approach,1,"To date, the measurement of homophily and perceived homophily has been fragmented, despite the generation of a perceived homophily scale by McCroskey, McCroskey, and Richmond (1975). Previous work utilizing this and other scales has had low explained variance and null results. The current study utilized a grounded research approach to generate items for a homophily scale that were based on how participants made judgments of homophily in natural settings. Results suggested that some items utilized in previous homophily studies (e.g., demographics and physical appearance) were, indeed, unimportant when individuals were making similarity judgments. A test of the scale indicated a high level of both face and construct validity, and explained variance was much higher than the explained variance in previous homophily studies.",Interpersonal Communication Interactive Poster Session,In Event: International Communication Association Annual Awards and Presidential Address
2014-0090,2014,Paper Session,Patterning Openness: Expanding Family Communication Patterns to Enhance Adult Adoptee Dual Family Identities and Self-esteem,3,"Grounded in family communication patterns theory (FCPT) and intergroup theorizing, the current study investigated the role of adoptive parent communication in adoptees’ abilities to integrate their personal and family identities into their sense of self. Informed by the Common Ingroup Identity Model (CIIM; Gaertner et al., 1994), we hypothesized that adoptees’ abilities to reconcile their personal identities with their shared family identities with birth and adoptive families would contribute to their well-being in adulthood. SEM analyses demonstrated that adoptive identity work and shared family identity mediated the relationship between parental communication and adoptee self-esteem. Specifically, adoption structural openness predicted adoptees‘ reflective identity exploration, which in turn predicted adoptive shared family identity and adoptee self-esteem. The current project serves as an important first step in understanding the role of family communication in fostering integration of the complex layers of identity within diverse families. We explore implications for FCPT, CIIM, and adoptive identity theorizing.",Interpersonal Communication Interactive Poster Session,In Event: International Communication Association Annual Awards and Presidential Address
2014-0091,2014,Paper Session,Social Network Analysis of Interactive Communication Patterns Among Graduate Students in the United States,1,"Graduate students often interact with a variety of academic and social connections which can be systematically captured and understood through a social network analysis approach. Extant studies have emphasized the need for more complex analysis of supportive relationships, particularly those involving directed sharing of information. This study describes the interactive communication patterns arising from social support that relate to the provision of advice, the connections and friends, and peers that graduate students turns to for professional or personal help. Data were collected from a cross-sectional sample of 31 graduate students. Descriptive statistics are presented using Quadratic Assignment and Multiple Regression Quadratic Assignment Procedure correlations, and data pertaining to the friendship network were analyzed with exponential random graphs models. Findings provides a summary of network information across six networks, and correlations were calculated to determine similarity across the networks. Practical implications related to developing interpersonal relationships of graduate students are discussed.",Interpersonal Communication Interactive Poster Session,In Event: International Communication Association Annual Awards and Presidential Address
2014-0092,2014,Paper Session,The Influence of Conversations Stimulated by Electoral Advertising on Political Trust,1,"Political campaign advertising is an instrument parties use to compete for the citizen’s trust during elections. Campaign advertising is increasingly broadcasted online due to the continual rise of digitalization. Furthermore, it has already been proven in other contexts that interpersonal communication has an influence on campaign effects. This study examines whether electoral advertising stimulates offline and online conversations, which are the factors that ultimately influence the people’s trust in political parties. For this analysis, data from a nationally representative long-term study was used in which eligible voters above 18 were interviewed in an online panel three weeks before the national election for the Bundestag 2013 (N=322). A 12 item measurement was developed to examine the parties’ trustworthiness. The results show that electoral advertising stimulates offline and online conversations and that these conversations influence the parties’ trustworthiness.",Interpersonal Communication Interactive Poster Session,In Event: International Communication Association Annual Awards and Presidential Address
