paper id,year,paper type,paper title,author number,abstract,session title,sub unit
2014-0134,2014,Paper Session,"Music and Mind for Human Rights: Voices from Jamaica's Music Community, Neuroscience, and Political Economy Intersect",1,"I investigate how global citizens might more effectively employ music and emerging findings from the science of music, as tools to claim their human rights and further shape the evolving human rights agenda. Sixty-five years have passed since the United Nations General Assembly adopted the Universal Declaration of Human Right. However, political and economic systems still deny billions of people their political, civil, economic, social and cultural rights promulgated in the Declaration and its covenants. I probe music's potential to affect this challenge through a methods process of multiple triangulation. Specifically, I research the livid experience within Jamaica's music community through critical ethnography; develop a ""Taxonomy on the Neuroscience of Music and Morality""; and analyze the global music sector through the political economy of human rights lens. Integrating the findings, I conclude that music is not only a tool for realizing human rights, but also that music capability itself is a human right to the extent that it develops cognitive and emotive capacities, serves agency and voice, and supports sociability, participation, and community. Further, I conclude that the music community is uniquely poised and with capacity to play a leadership and facilitate role in the moral, scientific and political discourse that clarifies not only collectively established human rights goals, and but as well the structures of the music sector and the overarching political economy necessary to reach the goals. The descriptions and analyses provided in the study contribute tools that the diverse agents and stakeholders can collectively employ to negotiate our respective responsibilities and rights in this process.",Ethnicity and Race in Communication Interactive Poster Session,In Event: ICA Plenary Interactive Paper/Poster Session and Reception
2014-0135,2014,Paper Session,"Gender Stereotypes in Gaming Behavior: Play Styles, Gaming Motives, and Genre Preferences",1,"The paper presents results of a study that examined the influence of gender role orientations on gaming motives, game genre preferences, and different play styles. Applying social role theory, a theoretical model that includes the social (cooperative and competitive play styles) and operational (explorative and goal-oriented play styles) quality of gaming behavior was analyzed. After collecting empirical data through an online survey (n = 317), hypotheses were tested by structural equation modeling. Moreover, moderating effects of sociodemographic variables (sex, age, and educational level) were examined. Findings provide evidence for the existence of gender-typed motives of play, genre preferences, and–to a small extent–gaming behavior. Multiple group analyses revealed that gender-typing of motives, preferences and play styles varies in strength and direction by biological sex, age, and educational level.",Game Studies Interactive Poster Session,In Event: ICA Plenary Interactive Paper/Poster Session and Reception
2014-0136,2014,Paper Session,Harsh Words and Deeds: Content Analyses of Offensive User Behavior in Online First-Person Shooter Games,5,"While extensive research has examined the prevalence and potential effects of potentially harmful video-game content produced by game developers, such as violence, profanity, and sexualized portrayals, almost no research has systematically examined the large range of potentially harmful content produced by players in increasingly popular online games. This player-generated content may actually be of more concern than content contained in the games themselves, as negative effects of online aggression and antisocial behavior on targeted users is well-documented. While potential effects of such antisocial and offensive online game content are not well understood, a first step toward exploring this concern is systematic documentation of offensive user-generated content in online games. To that end, a pair of in-progress content analyses is documenting a range of offensive user-generated content, including player utterances and user-generated images, from thousands of users in popular first-person shooter video games.",Game Studies Interactive Poster Session,In Event: ICA Plenary Interactive Paper/Poster Session and Reception
2014-0137,2014,Paper Session,"Object, Me, Symbiote, Other: A Social Typology of Player-Avatar Relationships",1,"In spite of how humans and nonhuman objects relate in very social ways (yelling at stop lights turned red, engaging the allures of beautiful shoes), the connections between players and avatars are examined in conspicuously parasocial ways. That is, the player-avatar relationship (PAR) is seen as one-way and non-dialectical as players think, feel, and acts toward the avatar. Drawing on HCI and cybernetics theories, the present study examines the potential for PARs to be fully social relationships, a potential not yet addressed in existing scholarship. Through thematic analysis of in-depth interviews with diverse World of Warcraft players, analysis revealed that PARs sometimes feature the fully social characteristics of self-differentiation, emotional intimacy, and varied agency. Further, the degree to which PARs were more or less social was associated with particular play practices and motivations. It is argued that these social differences can be best understood according to a four-point PAR typology.",Game Studies Interactive Poster Session,In Event: ICA Plenary Interactive Paper/Poster Session and Reception
2014-0138,2014,Paper Session,Seeing Through the Avatar’s Eyes: Effects of Perspective and Gender Match on Identification and Enjoyment,2,"This exploratory study examines the ways in which avatar perspective and gender match may interact to influence identification and enjoyment while also parsing apart identification into several distinct dimensions: physical similarity, homophily, customization, perspective-taking, wishful identification, and liking. Seventy-eight college students played a video game in which avatar perspective (first-person vs. third-person) and gender match were manipulated. Results showed that, while perspective and gender match did not influence identification and enjoyment separately, they did together. Support was also found for a multi-dimensional conceptualization of identification, as they were affected differently by the experimental conditions. They also predicted enjoyment to differing degrees. Implications of the findings are discussed.",Game Studies Interactive Poster Session,In Event: ICA Plenary Interactive Paper/Poster Session and Reception
2014-0139,2014,Paper Session,A Girl Worth Fighting For: A Critique of Freedom and Domination in Queering Disney’s Mulan,1,"Disney, a company internationally renowned for its family friendly programming, recently revealed that its Disney Princess character Mulan was bisexual on its prime time television program, Once Upon A Time. This paper critiques this queering’s dimensions of freedom and domination through the lens of critical rhetoric. In terms of freedom, Mulan’s queering represents a progressive step forward for Disney, as the company previously had no LGBT characters. The choice of Mulan is also examined in its dimensions of domination. Disney’s choice of the most masculine princess as a bisexual reinforces harmful stereotypes about LGBT women, while its choice to only permit a LGBT character on a program aimed at adults neglects its role as a moral educator of children. A suggestion of the creation of an original animated lesbian or bisexual princess is offered as a means of overcoming the oppressive nature of Mulan’s queering.","Gay, Lesbian, Bisexual and Transgender Studies Interactive Paper Session",In Event: ICA Plenary Interactive Paper/Poster Session and Reception
2014-0140,2014,Paper Session,Culture Jamming (and Tucking): RuPaul’s Drag Race and Unconventional Reality,1,"Reality television is rarely subversive, but occasionally a program enters the popular culture zeitgeist that not just contributes to the genre, but rather exposes it. Launched in 2009, Logo’s RuPaul’s Drag Race presents a case study on how occasionally even commercial television can serve as a type of culture jamming. This essay offers a critical analysis of RuPaul’s Drag Race and argues that the typical reality competition format is both exploited and exposed as a type of culture jamming that is uniquely queer. Through interviews with queer audiences, this essay also looks at how audiences understand and react to promotional realities.","Gay, Lesbian, Bisexual and Transgender Studies Interactive Paper Session",In Event: ICA Plenary Interactive Paper/Poster Session and Reception
2014-0141,2014,Paper Session,A Global Perspective of Press-State Relations: Comparing the Source Structure in Three News Agencies’ Coverage of the North Korea Missile Crisis,2,"This study conducted a social network analysis to find out how source structure in news coverage of the three new agencies has changed over time during the North Korea missile crisis and how the change of source structure reflects the dynamics of international politics on North Korean missile crisis. Evidence in this study shows that a Cold War diplomacy still remains in the negotiation table of North Korean missile crisis. Strong alliance among the U.S., Japan, and South Korea has been found in every stage of the crisis, while China, Russia, and North Korea have formed a coalition. In addition, variance of issue framing by news sources over time also demonstrates a level of competition and cooperation among the U.S., China, and South Korea.",Global Communication and Social Change Interactive Poster Session,In Event: ICA Plenary Interactive Paper/Poster Session and Reception
2014-0142,2014,Paper Session,A Framing Analysis of Media Coverage of Food Safety Issues in China,1,"Using framing as a theoretical approach, the study conducted content analysis with news stories covering two food safety issues occurred in China in recent years: the milk powder scandal and the trench oil scandal. The study attempted to: 1) reveal the general feature of news coverage of food safety issues in Chinese print media; 2) identify the different frames used between the party press and commercial press; 3) explore the change in media coverage of food safety issues that have occurred across two cases. Results suggested that over time, framing of food safety issues have abandoned the traditional simple and straightforward pattern, but it has been applying more profound and holistic perspectives. In addition, no significant difference was found between party press and commercial press in covering food safety issues, reflecting of structural dependencies of commercial press in the current media system. Social and cultural implications were also discussed.",Global Communication and Social Change Interactive Poster Session,In Event: ICA Plenary Interactive Paper/Poster Session and Reception
2014-0143,2014,Paper Session,Constituting and Engaging in Transnational Media Activism Locally: A Case Study of Hong Kong In-Media,1,"Since the last decade, concomitant with the development of the global justice movement, there has been an emergence of transnational media activism - a rapid rise of Internet-based media activisms around the globe, posing increasing challenges to the political-economic establishments and media status quo.
This is a case study of a local media activism organization in Hong Kong - the Hong Kong In-media. Through an analysis of its historical developments, it discusses how a local media activism is situated in and connects with the broader landscape of transnational media activism. The connection between the local and transnational media activisms is shown in the local activists’ appropriation of the ideas and practices from the global exemplars, and in their attempt to mobilize transnational resources by forging tangible co-operations with the counterparts elsewhere. Their contributions to transnational media activism in particular and transnational activism in general will be discussed.",Global Communication and Social Change Interactive Poster Session,In Event: ICA Plenary Interactive Paper/Poster Session and Reception
2014-0144,2014,Paper Session,Crowdsourcing for Philanthropy: The Case of Kiva.org,1,"Historically, the non-profit sector has been slow to adopt information and communication technology (ICT). The advent of digital native non-profit organizations, however, is influencing the sector. Kiva.org is a website that allows users to fund microloans to small business owners in developing nations. This study uses semi-structured qualitative interviews of Kiva users to explore this form of philanthropy as a potential example of crowdsourcing, a concept recently introduced to scholarship and still in flux. The study finds that Kiva may be a form of crowdsourcing, and discusses the implications for crowdsourcing theory as well as the non-profit sector generally.",Global Communication and Social Change Interactive Poster Session,In Event: ICA Plenary Interactive Paper/Poster Session and Reception
2014-0145,2014,Paper Session,Examining the Role of Facebook in Political Participation Among Young Voters in Georgia,1,"The exploratory study of young Georgian voters (N=432) demonstrated that young Georgians were interested in public affairs, had a strong sense of collective efficacy, supported democracy and had overwhelmingly voted in the 2012 Parliamentary Elections. However, they were detached from many forms of political participation, both online and offline. Facebook, in which young Georgians spent considerable amount of time, emerged as a platform for engagement in a public affairs discourse, such as reading and viewing and occasional commentary/ posting. Those who were active in the public affairs discourse were also highly likely to participate in Facebook’s political activities and in real life activities, although less frequently. Online and offline political participation were strongly and positively interrelated, countering beliefs of some scholars that Facebook-based participation displaces traditional forms of political participation. Young voters’ strong sense of collective efficacy predicted participation in real settings but not in Facebook-based political activities.",Global Communication and Social Change Interactive Poster Session,In Event: ICA Plenary Interactive Paper/Poster Session and Reception
2014-0146,2014,Paper Session,Global Social Networking Beyond the Digital Divide? Mobile Digital Technology and the Dictator’s Dilemma,1,"Are authoritarian regimes ever really successful at stopping at the use of social networking services? This study conducts a panel data analysis on 182 countries observed from 2010 to 2012, to investigate a cross-country difference in the adoption of Facebook. The findings show that, concerning the diffusion of recent ICTs, authoritarian rules have a limited ability to maneuver in obstructing the way to the global social network. Rather, the governments’ suppression promotes the increased use of Facebook in response to the spread of cell phones and the growth of the urban population. Finally, a wider Facebook reach occurs when people perceive higher levels of political efficacy under such authoritarian controls, whereas it corresponds to greater public unrest in democracies.",Global Communication and Social Change Interactive Poster Session,In Event: ICA Plenary Interactive Paper/Poster Session and Reception
2014-0147,2014,Paper Session,The Multisitedness of Global Media,1,"This paper examines the definitional challenges of the concept global media from several approaches. First, different theoretical traditions have formulated their own understandings on global media. Second, it’s long been controversial on how to comprehend the concept of globalization. Third, the difficulty in perceiving digital divide has complicated the global media production and consumption. Fourth, it’s hard to fully grasp the process of identity construction on various sites. This paper argues that the primary characteristic of global media is multi-sitedness, which is implicated and developed by each challenge mentioned above. The flexibility in understanding global media provides more space for researchers to examine the information flow among various sites.",Global Communication and Social Change Interactive Poster Session,In Event: ICA Plenary Interactive Paper/Poster Session and Reception
2014-0148,2014,Paper Session,"Tobacco Content on Smoking Among Females in Chinese Newspapers, 2005 – 2013",2,"China has 12.6 million female smokers and smoking rate is increasing among young women. The present study examined how Chinese newspapers cover female smoking by analyzing the published news articles (N = 105) from 2005 to June 2013. Results showed only a small number of news articles, 105 in 8 years, addressed female smoking. These articles were given low prominence in newspapers and tobacco-control services specific to women were rarely mentioned. Only one half of the articles included tobacco-control content from a women’s perspective and these reports tended to adopt a loss frame over a gain frame. In order to slow down the increasing rate of smoking among women, Chinese media should offer more tobacco control information that is relevant to women, such as highlighting unique health risks among women and addressing the misconception that smoking is associated with attractiveness, which is widely promoted by “women’s cigarettes”.",Global Communication and Social Change Interactive Poster Session,In Event: ICA Plenary Interactive Paper/Poster Session and Reception
2014-0149,2014,Paper Session,“Bitch is So Bitch”: Making Sense of Audience Responses to Global Counterflow of Chinese TV Series,1,"The subject globalization and its influence on the audience is by no means a new research topic, particularly those that examines the influence of the West or the U.S. on the rest of the world. Not many studies have considered the audiences from the exportation side, and their view on the process of globalization. Thus, this paper asks the fundamental question, “How do audiences feel when their cultural products are exported into another country?” By using the case of memes that circulated in response to the news that a Chinese TV series The Legend of Zhenhuan is going to enter the U.S. market, this paper examines the cultural expectations that Chinese audiences place on their cultural exports. The analysis reveals a complicated case of cultural works that simultaneously arouse anxiety about China’s complicated culture and its impossibility to translate well in the global market, and reliefs them through self-mockery and satire. This paper argues that the process of globalization not only impacts the importing countries but the exporters as well. Through the examination of the audience’s expectations for global cultural expansion, this paper shows that there are many more nuanced cultural undercurrents that motivate or dissuade a country to enter the global market other than the spread of power or ideology.",Global Communication and Social Change Interactive Poster Session,In Event: ICA Plenary Interactive Paper/Poster Session and Reception
2014-0150,2014,Paper Session,An Investigation of Student Perceptions of Health Care Reform: New Findings and New Directions,1,"Lack of knowledge about health care reform is quite common and health care reform uncertainty levels are high (Robert Wood Johnson Foundation, 2013). The current research replicates and extends recent work about health care reform information seeking which demonstrated predicted outcome value is the best predictor of information seeking. Unlike the previous work, this data collection took place after health care reform implementation, uses a different sample, and includes new variables of interest (e.g., deviance, knowledge, involvement). Results suggest uncertainty levels have, interestingly, increased post-implementation, and students want to receive health care reform information from friends and family or online, from non-partisan sources, and in varied formats. The data also demonstrate that predicted outcome value of health care reform information, uncertainty tolerance, and involvement significantly predict intentions to seek information about health care reform. Implications of these findings as well as suggestions for future research are discussed.",Health Communication Interactive Poster Session,In Event: ICA Plenary Interactive Paper/Poster Session and Reception
2014-0151,2014,Paper Session,Implementing an Evidence-Based Breast Cancer Support and Communication Tool as Standard Care,8,"While many women turn to the Internet to obtain information, it is unlikely that unstructured internet use provides optimal benefit to women newly diagnosed with breast cancer, due to uneven quality, conflicting claims, redundancy, and search engine idiosyncrasies which may make finding information difficult. To answer the need for information and support, an Interactive Cancer Communication System (""CHESS"") was developed to provide access to integrated information for decision-making, behavior change, and emotional support, and has been validated in randomized trials. This research reports on the process of achieving implementation in real-world settings at two Denver healthcare systems. This observational case study reports on the process of real-world implementation and the barriers and facilitators of integrating CHESS into standard care. Results from this study provides guidance for implementation of other programs in large organizations.",Health Communication Interactive Poster Session,In Event: ICA Plenary Interactive Paper/Poster Session and Reception
2014-0152,2014,Paper Session,Influencing Help Seeking Among People With Elevated Depressive Symptomatology: Mistargeting as a Persuasive Technique,3,"Influenced by the overheard communication technique, two experimental studies assessed whether a depression public service announcement (D-PSA) appearing to be intended for someone else (e.g., “do you have a friend who is depressed?”) could influence people with depression. In the first study, participants viewed a mistargeted print D-PSA or a direct D-PSA. In Study 2, participants viewed a mistargeted video D-PSA, a direct D-PSA, or a control ad. In both studies the mistargeted D-PSAs significantly weakened the association between depression and negative help seeking inclinations. Further, among people with heightened levels of depression the mistargeted D-PSA resulted in significantly greater help seeking intentions from close friends and a romantic partner than a direct D-PSA (study 1). In study 2, among people with heightened levels of depression, the mistargeted D-PSA resulted in more favorable attitudes and intentions toward help seeking than both a direct D-PSA and a control ad.",Health Communication Interactive Poster Session,In Event: ICA Plenary Interactive Paper/Poster Session and Reception
2014-0153,2014,Paper Session,Mortality Salience and Identification Processes in Predicting Organ Donation Outcomes,2,"Despite attitudes toward organ donation in US culture being positive, the rates of donation behavior remain dismally low. Therefore, there is a need for more research on variables which can increase positivity, willingness, and behavioral intentions in potential donors. The present study applies terror management theory and social identity to the organ donation context. Results indicate that reminders of death through narrative may improve organ donation outcomes as a form of worldview defense, through identification and death thought accessibility as mediators. However, this is only the case when the characters in the narrative are not members of a disliked outgroup. When the character is a member of a disliked outgroup (in this case, Arab ethnicity), organ donation outcomes become more negative. These results have practical implications for organ donation persuasive message creation.",Health Communication Interactive Poster Session,In Event: ICA Plenary Interactive Paper/Poster Session and Reception
2014-0154,2014,Paper Session,On a Scale of Health Uncertainty,2,"Uncertainty has been recognized as a fundamental construct in health communication. The conceptualization regarding its definition, attribute and scope, however, is not yet clear. In this article, health uncertainty was explicated as the psychological state in which one is incapable of appraising one’s health status and/or making health-related decisions. It was proposed that health uncertainty comprises four dimensions: information uncertainty, condition uncertainty, efficacy uncertainty, and emotion uncertainty. A 17-item scale was developed as a measurement instrument. Four external variables (i.e. health literacy, perceived susceptibility, perceived severity, and information management) were used to test the construct validity of the sale. Multilevel confirmatory factor analyses of data from college students (N=238) showed that the scale was unidimensional on the second order. The results indicated that the scale exhibited good internal and external consistency, construct validity, as well as good reliability. Implications for future research were discussed.",Health Communication Interactive Poster Session,In Event: ICA Plenary Interactive Paper/Poster Session and Reception
