session type,session title,sub unit,chair name,chair aff
Paper Session,Online Harassment and Bullying,Children Adolescents and the Media,Adolescents’ Online Peer Support on Cyberbullying: A Thematic Analysis of Online Support Group Fora - Sara Bastiaensens; Can Emotion Regulation Serve as a Tool in Combatting Cyberbullying? - Anouk H. den Hamer; Cyberbullying Policies of Social Media Companies - Tijana Milosevic; Differences in Friendship Networks and Experiences of Cyberbullying Among Korean and Australian Adolescents - Jee Young Lee; Exposure to Cyberbullying as a Bystander: An Investigation of Desensitization Effects Among Early Adolescents - Sara Pabian; Longitudinal Patterns of Involvement in Cyberbullying: Results From a Latent Transition Analysis Among Adolescents - Ruth Festl; Nice or Naughty? Adolescents' Online Prosocial and Antisocial Behavior - Sara Erreygers; Prevalence and Characteristics of Online Slut-Shaming in Belgian Adolescent Girls - Kathleen Van Royen,University of Antwerp; VU University; Elly A. Konijn; ECREA - European Communication Research and Education Association; University of Canberra; Yeji Kwon; University of Antwerp; Heidi Vandebosch; German Youth Institute; Jens Vogelgesang; Universiteit Antwerpen; Heidi Vandebosch; University of Antwerp; Karolien Poels
Paper Session,Beyond Lora: Female Gender in Games,Game Studies,,
Paper Session,Journalism in Authoritarian and Postconflict Societies,Journalism Studies,,
Paper Session,"Mobile Health Communication: Health Apps, Activity Tracking, Texting, Online",Health Communication,,
Paper Session,"Facebook Studies: Effects, Meanings, and Prominence",Communication and Technology,,
Paper Session,Cultural and Community Variables in Health Communication Studies,Health Communication,,
Paper Session,Social Media and Persuasion,Communication and Technology,,
Paper Session,Journalism Education and Journalism Students,Journalism Studies,,
Paper Session,Global Journalistic Cultures and Practices,Global Communication and Social Change,,
Paper Session,Advances in the Study of Advertising and Branding,Mass Communication,,
Paper Session,"Quantitative Inquiries: Stereotypes, Attitudes, Parasocial Relationships","Lesbian, Gay, Bisexual, Transgender and Queer Studies",,
Paper Session,Visual Aspects In Mobile Media,Mobile Communication,,
Paper Session,Political Conversations Online: Disagreement and Incivility,Political Communication,,
Paper Session,Theories and Practices in Media Industry Research,Media Industry Studies,,
Paper Session,Individual and Interpersonal Dynamics in Organizational Communication,Organizational Communication,,
Paper Session,"Boundaries: Questioning the Local, Global, and Transnational",Media Industry Studies,,
Paper Session,Digital Media and Political Protest,Political Communication,,
