session type,session title,sub unit,chair name,chair aff
Paper Session,Asian and Asian American Concerns,Ethnicity and Race in Communication,,
Paper Session,Learning and Thinking Through/With/By Media,Children Adolescents and the Media,Epistemological Dimensions on Screen: The Role of Television Presentations in Changing Conceptions About the Nature of Knowledge and Knowing - Lars Guenther; A Parental Perspective on Apps for Young Children - Francette Broekman; Economically Disadvantaged but Academically Focused: The Low-Income Chinese Immigrant Families’ Acculturation; From Hanging Out to Geeking Out: Socializing as a Pathway to Computational Thinking - Samantha Shorey; A Meta-Analytic Review of Ready To Learn Media’s Effects on Young Children’s Literacy - Lisa B. Hurwitz; A Qualitative Study Informing the Educational Content of an Indian TV Program (Galli Galli Sim Sim) - Dina L. G. Borzekowski; Measuring With Murray: Touchscreen Technology and Preschoolers’ STEM Learning - Fashina Alade; Not Feeling it; Literacy and Identity Links Forging Digital Inclusion? Critical Reflections and Signposts From a Qualitative Study - Panayiota Tsatsou,CREST/ Stellenbosch University; Sabrina Heike Kessler; University of Amsterdam; Jessica Taylor Piotrowski; Parental Involvement; University of Washington; Benjamin Mako Hill; Northwestern University; Univ. of Maryland; Northwestern University; Leanne Beaudoin-Ryan; Not Getting it; U of Leicester - Department of Media and Communication; Gillian Youngs
Paper Session,Organizational Communication Research Escalator - Extended Session (Part 1),Organizational Communication,Stacey L. Connaughton; William C. Barley,Purdue U; University of Illinois
Paper Session,"News Audiences: Users, Consumers, Citizens?",Journalism Studies,,
Paper Session,Antismoking Health Messages and News,Health Communication,,
Paper Session,Mental Health and Depression,Health Communication,,
Paper Session,Social Support Online,Communication and Technology,,
Paper Session,Communication Technology and Work,Communication and Technology,,
Paper Session,International/Transnational Journalism,Journalism Studies,,
Paper Session,The Study of Political Entertainment Media,Mass Communication,,
Paper Session,Politicians in the News: With What Effect?,Political Communication,,
Paper Session,Consumption and Identity in East Asia,Popular Communication,,
Paper Session,Exploring the Power of Corporate Social Responsibility,Public Relations,,
Paper Session,Who We Are is How We Talk: Predicting Interpersonal Communication Processes,Interpersonal Communication,,
Paper Session,"Cultural Adaptation, Developmental Communication, and Community",Intercultural Communication,,
Paper Session,Identity Matters in Social Interaction,Language & Social Interaction,,
Paper Session,Collective Action in the Digital Era,Political Communication,,
Paper Session,Self-Presentation and Appearance Issues of Youth in Media,Children Adolescents and the Media,Dysfunctional Appearance Beliefs Among Tweens: The Role of Beauty-is-Good Messages and the Peer Appearance Culture - Jolien Trekels; Preteens’ Reliance on and Internalization of Media Appearance Ideals: Triggers and Consequences - Ann Rousseau; The Role of Heterosexual Expectations in the Relationship Between Early Adolescents’ Media Exposure and the Endorsement of Dysfunctional Appearance Beliefs - Laurens Vangeel; The “Good Girls”: Exploring Features of Female Characters in Children’s Animated Television - Sarah Pila; Hypergender Teens on Social Networking Sites: Investigating Reciprocal Relationships Between Gender Role Orientations and Sexy Online Self-Presentations - Johanna M.F. van Oosten,U of Leuven - School for Mass Communication Research; U of Leuven - School for Mass Communication Research; U of Leuven; Jolien Trekels; Northwestern University; Julie Dobrow; University of Amsterdam; Laura P. Vandenbosch
Paper Session,Organizational Communication Research Escalator - Extended Session (Part 2),Organizational Communication,William C. Barley; Stacey L. Connaughton,University of Illinois; Purdue U
Paper Session,"The Many Faces of ""Commercialization""",Journalism Studies,,
Paper Session,"Vaccine Communication: Childhood, Flu, HPV",Health Communication,,
Paper Session,"Holistic, Complementary, and Alternative Medicine and Therapies",Health Communication,,
Paper Session,New Methods in Communication and Technology,Communication and Technology,,
Paper Session,Technology Use Within the Family and Across the Lifespan,Communication and Technology,,
Paper Session,Reporting on Disaster and Conflict,Journalism Studies,,
Paper Session,Social Movements Around the World,Global Communication and Social Change,,
Paper Session,Network Analysis in Mass Communication Research,Mass Communication,,
Paper Session,Advances in the Study of Film,Mass Communication,,
Paper Session,"Populist Parties, Populist Appeals, and Media Populism",Political Communication,,
Paper Session,"Cultural Influence on Friendship, Intimacy, and Conflict at Work",Intercultural Communication,,
Paper Session,Representing Difference and Deviance,Popular Communication,,
Paper Session,The Power of Social Media,Public Relations,,
Paper Session,"The Role of Language, Narratives, and Framing in Intergroup Relations",Intergroup Communication,,
Paper Session,"Media, Ferguson, and #BlackLivesMatter",Ethnicity and Race in Communication,"Voices of the Marginalized: An Analysis of Social Media Message Frames and Functions in a Ferguson Social Justice Movement - Osita Iroegbu; How #BlackLivesMatter: Exploring the Role of Hip-Hop Celebrities in Constructing Racial Identity on Black Twitter - Summer Harlow; ""Broken Windows"" in the Ferguson Era: Original Theory and Contemporary Discourse - Elena Rosa Maris; The Ballot or the Bullet 50 Years Later: Examining the Ferguson Protests Through the Words of Malcolm X - Fred Jennings",Virginia Commonwealth University; Yuan Zhang; Florida State University; Anna Benbrook; University of Pennsylvania; University of Missouri
Paper Session,Frames in the News: Where Do They Come From?,Political Communication,,
Paper Session,"Sex, Sexting, Sexuality",Children Adolescents and the Media,Boundaries of Sexual Communication: A Mixed-Method Study Exploring Chinese Young Adults' Engagement With Online Sexual Health Information - Jingwen Zhang; Do Media Light Their Fire? The Dual Role of Sexualizing Media in Adolescent Sexual Behavior - Ann Rousseau; Dutch Adolescents' Motives; Exploring the Explanatory Roles of Perceived Utility and Instrumental Attitudes in the Relationship Between Sexually Explicit Internet Material and Casual Sex - Laura P. Vandenbosch; Sexting; Sexting: Adolescents' Perceptions of the Motives and Consequences of Engaging in the Behavior - Joris Van Ouytsel; Visiting Chat Rooms,U of Pennsylvania; Chloe Nurik; U of Leuven - School for Mass Communication Research; Ine Beyens; Perceptions; School for Mass Communication Research (University of Leuven) / MIOS (University of Antwerp); Jochen Peter; Snapchat; University of Antwerp; Ellen Van Gool; Dating Websites
Paper Session,"CAT Hybrid Session 3: Social Media, Interactions, and Self-Presentation",Communication and Technology,,
Paper Session,Flashlights Game Studies Division,Game Studies,,
Paper Session,Qualitative Studies of Provider-Patient Communication,Health Communication,,
Paper Session,"Big Data & Networks: Connecting Communities, Organizations, and Reviews",Communication and Technology,,
Paper Session,"Online Health Literacy, Information Processing, and Seeking",Health Communication,,
Paper Session,"Online Dating: The Beginning, Middle, and End",Communication and Technology,,
Paper Session,"Arguments, Argumentation, and Language Competence",Intercultural Communication,,
Paper Session,The Study of Framing in the Context of Politics,Mass Communication,,
Paper Session,Promising Student Papers,Information Systems,Control Your Facebook: An Analysis of Online Privacy Literacy - Miriam Bartsch; Variation in Probe Tone Frequency Affects Secondary Task Reaction Time - Edgar Jamison-Koenig; Me(n)tal Health: Social Identity Mediates Psychological Recovery Effects of Music Listening - Sabine Reich,U of Hamburg; Tobias Dienlin; Indiana University; Joshua D. Sites; University of Music
Paper Session,The Study of Emotion and Entertainment Media,Mass Communication,,
Paper Session,Studying News Exposure in the Digital Era,Political Communication,,
Paper Session,"Environmental Narratives: Gender Roles, Citizen Engagement, and Storytelling",Environmental Communication,,
Paper Session,Media Life: Markets and Ethics,Popular Communication,,
Paper Session,Technologies at Work,Organizational Communication,,
Paper Session,Powerful Explorations: Public Relations Theory,Public Relations,,
Paper Session,"Privacy, Copyright, and Piracy",Media Industry Studies,,
Paper Session,"The Visual Powers of Place, Space, and Landscape",Visual Communication Studies,,
Paper Session,The Agenda-Setting Role of Old and New Media,Political Communication,,
Paper Session,"News, Journalism, and Information Literacy",Children Adolescents and the Media,Unveiling Information Literacy of Digital Natives in Secondary Schools: A Swiss Example - Katarina Stanoevska-Slabeva; What Makes Adolescents More Engaged Citizens?: The Effects of Skill; Journalism for Children: From Kids to Pirates and Princesses? - Kristin Orgeret; What Makes the Young Read the News? Exploring Factors That Influence Adolescents’ Offline and Online News Reading Behavior - Sacha Sillekens,University of St. Gallen; Severina Mueller; Information; Oslo and Akershus U College; Radboud University; Daniel Toebes
Paper Session,The Power of Trust in Public Relations,Public Relations,,
Paper Session,Provider-Patient and Other Hospital-Based Health Communication,Health Communication,,
Paper Session,Varying Visibilities in Social Media,Communication and Technology,,
Paper Session,Health Communication in/on Social Media,Health Communication,,
Paper Session,Motivations for Technology Adoption and Use,Communication and Technology,,
Paper Session,Images of Women Across Cultures,Intercultural Communication,,
Paper Session,"What is ""News Content""? Perspectives on Texts and Production",Journalism Studies,,
Paper Session,Collective Action and Digital Advocacy,Global Communication and Social Change,,
Paper Session,Advances in Third-Person Effects Research,Mass Communication,,
Paper Session,Participation and Governance Processes in Social Change,Global Communication and Social Change,,
Paper Session,"Media, Race, Ethnicity, and Stereotypes",Mass Communication,,
Paper Session,"Young Citizens, Social Media, and (Online) Political Participation",Political Communication,,
Paper Session,Identity and Power Relations in Organizations,Organizational Communication,,
Paper Session,Work Processes and Production Practices in the Media Industry,Media Industry Studies,,
Paper Session,"Studies of Talk-in-Interaction: Achieving Misalignment Stance, Indexing Membership, Making Requests, and Telling Stories",Language & Social Interaction,,
Paper Session,Researching the Effects of Visual Communication,Visual Communication Studies,,
Paper Session,Between Partisan Media and Partisan Opinions,Political Communication,,
Paper Session,"Expectations, Strategies, and Issues of Youth Social Media Use",Children Adolescents and the Media,Extending The Social Cognitive Model: Examining External and Personal Antecedents of Social Network Sites Use Among Singaporean Adolescents - Edmund W. J. Lee; “I Feel … #happy #annoyed”: Experiencing and Regulating Emotions on Social Media - Anne Vermeulen; Developing a Framework for Researching Children’s Online Risks and Opportunities in Europe - Giovanna Mascheroni; Exploring Adolescents’ Views on Social Networking Sites’ Role Within Adolescent Romantic Relationships and Dating Experiences - Joris Van Ouytsel; Picture Perfect: The Direct Effect of Manipulated Instagram Photos on the Body Image of Adolescent Girls - Mariska Kleemans; The Effect of Social Media on Positive Youth Development - Ah Ram Lee; Adolescents’ Expectations About Their Friends' Online Behavior - Annabel Draaijers; College Students’ Positive Strategic Social Media Use and Stress Coping - Ling Fang,Nanyang Technological University; Shirley S. Ho; University of Antwerp; Wannes Heirman; Universita' Cattolica of Milano; Sonia Livingstone; University of Antwerp; Ellen Van Gool; Radboud University Nijmegen; Serena Daalmans; University of Florida; Jungyun Won; Erasmus University Rotterdam; Jeroen Jansz; Bowling Green State U; Louisa Ha
Paper Session,Best Papers in Game Studies Division,Game Studies,,
Paper Session,Empowering the World: Global Public Relations,Public Relations,,
Paper Session,"Social Support for Health: Information Seeking, Obesity/Eating, Cancer",Health Communication,,
Paper Session,Communication and Technology Division Top Papers,Communication and Technology,,
Paper Session,Suicide and Stigma Studies in Health Communication,Health Communication,,
Paper Session,Mobile Social Media,Mobile Communication,,
Paper Session,Histories of Communication Technology: Infrastructures and Flows,Communication History,,
Paper Session,Top Four Papers in Interpersonal Communication,Interpersonal Communication,,
Paper Session,The Study of Framing in the Context of Health,Mass Communication,,
Paper Session,"Focus on Asia: Media Receptions, Productions, and Activisms in China, South Korea, and Bangladesh",Feminist Scholarship,Decoding Xiao Hong in The Golden Era (2014): A Reception Analysis of Chinese Women Audience Members’ Film-Viewing Experiences - Li Chen; Smashing Patriarchy With Cell Phones? Technofeminist Critique on Mobile Phone-Enabled Women’s Empowerment Programmes in Bangladesh - Iris Segers; Gendering ‘Authenticity’ of Military Experience: How Male Audiences of Korean Celebreality Show Real Men Reconstruct Hegemonic Masculinity - Woori Han; South Korean Hostess Film and Censorship During the Military Regime (1960-1979) - Molly Hyo Kim; What Happened to Those Tomboys Several Years Later? Empowerment From Super Girls’ Voice for Girls in China (2007-2015) - Li Cui; Communication for the Empowerment of Women in China: Group Actors; Blogging for the Self-Empowerment of Chinese Women: Voice as Communication to Negotiate Change - Xiao Han; Producing Gendered Migration Narratives in China: A Case Study of Dagongmei Tongxun by a Local NGO - Siyuan Yin,Syracuse University; Erasmus University Rotterdam; Payal Arora; University of Massachusetts Amherst; Claire Claire Lee; Ehwa Women's University; Southwest University; Xinzhi Zhang; the Internet’s Communicative Affordances; Communication University of China; University of Massachusetts at Amherst
Paper Session,Knowledge and Expertise in Organizations,Organizational Communication,,
Paper Session,Top Faculty Papers in ERIC,Ethnicity and Race in Communication,,
Paper Session,"Fandom: Behaviors, Attitudes, Values",Sports Communication,,
Paper Session,Policy Perspectives on Internet Rights for Citizens and Consumers,Communication Law & Policy,,
Paper Session,Messages That Move,Theme Sessions,,
Paper Session,Crisis Communication in the Health Contexts,Public Relations,,
Paper Session,"Exploring the Meaning of Sharing, Citizenship, Communication, and Complaining in Cultural Discourses",Language & Social Interaction,,
Paper Session,The Study of Adolescents in Mass Communication Research,Mass Communication,,
Paper Session,Environmental Communication Business Meeting,Environmental Communication,,
Paper Session,Gendering Politics and Political Activisms,Feminist Scholarship,What's in a Label? Gender Marking Political Leadership - Linda Trimble; Gendered Campaign Tweets: The Cases of Hillary Clinton and Donald Trump - Jayeon (Janey) Lee; Body Blows Art; Agency as a Responsive Creation: Arab Women; #LifeOfAMuslimFeminist: The Political Efficacy of Online Community Building - Laura E Strait,University of Alberta; Lehigh University; Young-shin Lim; Activism; Revolutions; University of Oregon
Paper Session,The Effects of Frames,Political Communication,,
Paper Session,National and Organizational Culture and Communication,Organizational Communication,,
Paper Session,"Interacting With Fans: Media, Athletes, Sponsors, Teams",Sports Communication,,
Paper Session,Between Propaganda and Government Communication,Political Communication,,
Paper Session,"Communication and Technology, Game Studies, and Information Systems Joint Reception","In Event: Communication and Technology, Game Studies, and Information Systems Joint Reception",,
Paper Session,"Language, Behavior, and Cognition and Their Influences on Perception and Communication Behaviors",Interpersonal Communication,,
Paper Session,Digital News: What It Is and How To Understand It,Journalism Studies,,
Paper Session,Obesity and Promoting Healthy Eating,Health Communication,How Movie Characters’ Eating Influences Viewers’ Eating: Effects of Unconscious Goal Contagion and Satiation - Shuo Zhou; Motivation for Obesity Reduction Among Adolescents in Low-Income Communities in Three U.S. States - Nancy W. Muturi; Promoting Healthy Eating on YouTube: A Content Analysis of PSAs - Xueying Zhang; Targeting Physical Inactivity: Effects of Three Consequence Frames on Subgroups’ Health-Related Perceptions and Behavioral Intentions - Anna Wagner; The Effects of Perceived Threat and Efficacy on Parents’ Health Information Seeking - Guido Zurstiege,Cornell University; Michael A. Shapiro; Kansas State U; Tandalayo Kidd; The University of Alabama; Kim Baker; Augsburg University; Freya Sukalla; U of Tuebingen; Alexander Ort
Paper Session,Exploring Technological Affordances,Communication and Technology,,
Paper Session,"Health Risks: Ebola, Polio, Violence, Emergencies",Health Communication,,
Paper Session,Understanding Digital Health,Communication and Technology,,
Paper Session,Making Journalism: How Journalists Produce the News,Journalism Studies,,
Paper Session,"Postcolonial Interrogations of Global Media, Culture, and Space",Global Communication and Social Change,,
Paper Session,The Study of Biases and News,Mass Communication,,
Paper Session,The Study of Media and Persuasion,Mass Communication,,
Paper Session,Parties and NGO's as Strategic Actors,Political Communication,,
Paper Session,Media Work in the Digital Age,Popular Communication,,
Paper Session,Understanding the Power of Stakeholders,Public Relations,,
Paper Session,GIFTS: Great Ideas for Teaching Students,Instructional & Developmental Communication,,
Paper Session,Balance and Bias in News Exposure,Political Communication,,
Paper Session,Advances and Challenges in Media Literacy Scholarship,Children Adolescents and the Media,Conceptual Challenges in Designing Measures for Media Literacy Studies - W. James Potter; Transmedia Literacy: Rethinking Media Literacy in the New Media Ecology - Carlos Alberto Scolari; The Development of a School-Based Intervention to Empower Children to Cope With Advertising - Esther Rozendaal; Impact of Internet Literacy,U of California; U Pompeu Fabra; Radboud University Nijmegen; Internet Addiction Symptoms on Quality of Life - Wenying Wu
Paper Session,The Power of Discussion Among Public Relations Scholars,Public Relations,,
Paper Session,Credibility and Trust in News,Journalism Studies,,
Paper Session,"Communication and Health Disparities in Migrant, Low-Income, and Digital Communities",Health Communication,,
Paper Session,Experimental Studies of Robots and Agents,Communication and Technology,,
Paper Session,Gaming and Health Communication,Health Communication,,
Paper Session,Social Media Gratifications,Communication and Technology,,
Paper Session,Negotiations and Portrayals of Motherhood in Media Discourses Around the World,Feminist Scholarship,The Comparative News Framing of Postnatal Care: Differences Between The United States and South Korea - Heeyoung Jung; Taking Care; Ideologies of Motherhood in Contemporary Israeli TV Commercials - Sigal Barak-Brandes; Feminist Agency and Social Activism: Mother-Daughter Discourse in a Campaign by Dove in Israel - Einat Lachover; Good Green Mothers: First-Time Mothers Explore Their Environmentalism Against Their Transition to Motherhood - Niveen AbiGhannam,Temple University; Nicole Henninger; Bringing Life: A Poststructuralist Feminist Analysis of Knowledge and Power Discourses of Maternal Health in an Urban Basti in India - Vinita Agarwal; Tel Aviv University; Sapir College; Sigal Barak-Brandes; University of Texas at Austin; Lucy Atkinson
Paper Session,Changes in Broadcasting and News Systems,Global Communication and Social Change,,
Paper Session,The Study of Online Opinion Expression,Mass Communication,,
Paper Session,Politicians on Social Media,Political Communication,,
Paper Session,"Culture, Politics, and Religion",Intercultural Communication,,
Paper Session,Interpersonal Communication in Families,Interpersonal Communication,,
Paper Session,"Copyright, Digital Cultures of Use, and Democracy",Communication Law & Policy,,
Paper Session,In the Digital Mirror: Avatars in Games,Game Studies,,
Paper Session,Antidrinking/Antialcohol Health Communication,Health Communication,,
Paper Session,The Politics of Social Media in China,Communication and Technology,,
Paper Session,"Framing Health Risk: Environment, Cancer, Genetics",Health Communication,,
Paper Session,Exploring Online Communites,Communication and Technology,,
Paper Session,Framing and Logics Surveillance and Privacy,Communication and Technology,,
Paper Session,"Interactional Affordances of Mediated Communication: The Analysis of Mobile Phones Use, Web TV Interviews, Webcast Football Talk, and Microblog Posts",Language & Social Interaction,,
Paper Session,Transportation and Media Entertainment,Mass Communication,,
Paper Session,The Study of News and Social Media,Mass Communication,,
Paper Session,Survey Research and Media Effects,Political Communication,,
Paper Session,Cultural Identity and Social Identity,Intercultural Communication,,
Paper Session,"Histories of Television: Practices, Cultures, and Institutions",Communication History,,
Paper Session,"Power [and, in, of] Public Relations",Public Relations,,
Paper Session,Check It Out: Fact Checking on Old and New Media,Political Communication,,
Paper Session,"Distracted, Dissatisfied, Drunk, and Other Disorders: Youth, Media, and Well-Being",Children Adolescents and the Media,Causes and Consequences of Internet Gaming Disorder - Sophie F Waterloo; The Effects of Advertising Exposure on Children’s Materialism; Dealing With Media Distractions: An Observational Study on Computer-Based Multitasking Among Children and Adults - Susanne E. Baumgartner; Media Multitasking and Sleep Problems: A Longitudinal Study Among Adolescents - Winneke van der Schuur,University of Amsterdam; Jeroen S Lemmens; Psychological Well-Being; U of Amsterdam; Sindy R. Sumter; University of Amsterdam; Susanne E. Baumgartner
Paper Session,Capturing Sight and Sound: Histories of Documentation,Communication History,,
Paper Session,"CAT Hybrid Session 4: Collaboration, Work, and Organizations",Communication and Technology,,
Paper Session,Journalism as Political Communication,Journalism Studies,,
Paper Session,Online/Internet Health Information Seeking,Health Communication,,
Paper Session,"Sex, Gender, and Technology",Communication and Technology,,
Paper Session,"Mediated Views of Health: Food, Size, Weight",Health Communication,,
Paper Session,Digital Advertising,Communication and Technology,,
Paper Session,Framing the News: International Perspectives,Journalism Studies,,
Paper Session,"Discursive Features of Condemnation, Blame Avoidance, Stancetaking, and Positioning in Political Communication",Language & Social Interaction,,
Paper Session,"New Contexts and Methods for Social Change: Crises, Campaigns, and Corporate Social Responsibility",Global Communication and Social Change,,
Paper Session,Advances in the Study of Science Communication,Mass Communication,,
Paper Session,Advances in the Study of Entertainment Media,Mass Communication,,
Paper Session,Political Information and News Exposure in Election Time,Political Communication,,
Paper Session,Use of Mobile Services in Different Contexts (High-Density),Mobile Communication,,
Paper Session,Four Square Pegs: Understanding Popular Communication,Popular Communication,,
Paper Session,Powerful Connections: Public Relations and Crisis Communication,Public Relations,,
Paper Session,"Models, Tools, and Methods for Visual Communication Research",Visual Communication Studies,,
Paper Session,Intervention and Privacy in Online Behaviour,Communication Law & Policy,,
Paper Session,Negative Campaigns and Campaign Negativity,Political Communication,,
