session type,session title,sub unit,chair name,chair aff
Paper Session,Preconference: 7th Annual Doctoral Consortium of the Communication Technology Division Breakout,Sponsored Sessions,,
Paper Session,Preconference: Journalism Studies Graduate Student Colloquium Breakout,Sponsored Sessions,,
Paper Session,Wanna Join? Teams and Clans in Games,Game Studies,,
Paper Session,"News as Text: Narrative, Myth, and Exemplars",Journalism Studies,,
Paper Session,Innovations in Cancer Communication Research,Health Communication,,
Paper Session,"Hashtags, Tweets, and Instagram",Communication and Technology,,
Paper Session,Science and Discourse Studies in Health Communication,Health Communication,,
Paper Session,Perceived Credibility Online,Communication and Technology,,
Paper Session,"Digital Media, Elections, and Politics",Communication and Technology,,
Paper Session,"Contention, Terrorism, and Media",Global Communication and Social Change,,
Paper Session,Audience Connections to Characters,Mass Communication,,
Paper Session,Media Psychology and the Study of Gender-Related Issues,Mass Communication,,
Paper Session,Selective News Exposure and Political Opinions,Political Communication,,
Paper Session,The Power of Dialogue in Public Relations,Public Relations,,
Paper Session,Inside Journalism Organizations,Media Industry Studies,,
Paper Session,Support and Coping in Interpersonal Relationships,Interpersonal Communication,,
Paper Session,"Constructions and Contestations of Gender in Gaming, Retail Ads, Sports Coverage, Prison Dramas, and Pornography",Feminist Scholarship,Gender; Portrayal of Women and Men in Chilean Retail Advertising: Female Stereotypes in a Society With Feminine Character? - William Porath; Dominating the (Female) Incarcerated Body: Gender and Medical Control in Television Prison Dramas - Katherine A Foss; From Cum Shots to Cunnilingus; Calling In Instead of Calling Out: Intergenerational Feminist Praxis in Digital Games Scholarship and Activism - Alison Harvey,Nationalism and Individualism: How Chinese Media Construct Tennis Elite During International Sporting Events - Qingru Xu; Pontificia Universidad Catolica de Chile; Claudia Labarca; Middle Tennessee State U; the Agentic and Objectifying Scripts of Feminist and Mainstream Pornography - Niki Fritz; U of Leicester - Department of Media and Communication; Stephanie Fisher
Paper Session,"Political Discourse, Ideology, and the Media",Political Communication,,
Paper Session,"I Know You Because I Saw You on TV, but Where Am I? Youth, Stereotypes, and Prejudice",Children Adolescents and the Media,Mexican Children’s Understanding of Criminals: A Social Representations Study - Beatriz Elena Inzunza-Acedo; Wanting to See People Like Me? Racial and Gender Diversity in Popular Adolescent Television - Morgan E. Ellithorpe; The Influence of Televised Gender Stereotypes and Counterstereotypes on Girls’ Perceptions of STEM - Bradley J Bond; Media,Universidad de Monterrey; University of Pennsylvania; Amy Bleakley; University of San Diego; Movies
Paper Session,Online and Health Information Seeking: High-Density Panel in Health Communication,Health Communication,,
Paper Session,"Last but Not Least: Why Do We Play? Technical Development, Sexualization, Motivation, and Clans",Game Studies,,
Paper Session,"Journalists and Their Sources: Relationships, Practices, Perceptions",Journalism Studies,,
Paper Session,"Message Design Research: Meta-Analyses, Message/Information Fatigue, Narratives",Health Communication,,
Paper Session,Fighting the Continuum of Violence From Flaming and Street Harassment to Domestic Violence and Rape,Feminist Scholarship,"Speaking ""Unspeakable Things"": Documenting Digital Feminist Responses to Rape Culture - Jessalynn Keller; The Logic of Connective Feminism: Toward an Intersectional Approach to Anti-Street-Harassment Activism - Rosemary Clark; Damaged Women; College Students’ Perceptions of Campus Sexual Assault: A Qualitative Study - Jane O'Boyle; ""Killed out of Love”: Domestic Violence Coverage in Hong Kong - Miriam Hernandez; Experiential Learning Through Documentary Methodology: A Platform for Breaking Down Rape Culture on College Campus - Jennifer Huemmer; Framing; Gamer-Hate and the “Problem” of Women: Finding Feminism - Jennifer Jenson",U of East Anglia; Kaitlynn D Mendes; The Annenberg School for Communication at the University of Pennsylvania; Godlike Men: Rape Mythologies in News Coverage of Bill Cosby and Inder Kumar - Lindsey Erin Blumell; University of South Carolina; Leigh M Moscowitz; City University of Hong Kong; Texas Tech U; Lindsey Erin Blumell; Flaming; York University; Suzanne Christine de Castell
Paper Session,Social Protests and Technology,Communication and Technology,Does Cyber-Proximity Matter? Social Media Network Exposure and Cross-National Protest Diffusion: Evidence From Event History Analysis of Arab Spring 2010—2011 - K. Hazel Kwon; Emotions in an Online Social Movement: A Study of India’s Nirbhaya Protest - Saifuddin Ahmed; Explaining Offline Participation in a Social Movement with Online Data: The Case of Observers for Fair Elections - Olessia Koltsova; Social Media's Effect on Youth Volunteers' Communication & Organizing Behaviors During the Rena Oil Spill - Sarah Lockwood; The Critical Periphery in the Growth of Social Protests - Sandra Gonzalez-Bailon,Arizona State University; University of California; National Research University Higher School of Economics; Galina Selivanova; University of Waikato; Celia Kay Weaver; University of Pennsylvania
Paper Session,Local Journalism: Community and Diversity,Journalism Studies,,
Paper Session,Globalization and Digital Media: Implications for Social Change,Global Communication and Social Change,,
Paper Session,"Media, Conflict, and Violence",Mass Communication,,
Paper Session,Predicting and Explaining Opinion Diversity,Political Communication,,
Paper Session,Experiencing Entertainment,Popular Communication,,
Paper Session,Team Communication and Technologies,Organizational Communication,,
Paper Session,Top Faculty Papers in Public Relations,Public Relations,,
Paper Session,Dating And Romantic Relationships Through Apps,Mobile Communication,,
Paper Session,Communication Law and Policy Conference Theme Session: Communicating With Power in Communication Law and Policy,Communication Law & Policy,,
Paper Session,Visual Framing and Storytelling Between the Affective and the Iconic,Visual Communication Studies,,
Paper Session,Responding to Exclusion and Inequality,Theme Sessions,,
Paper Session,"Different Types of Media Content, Different Effects?",Political Communication,,
Paper Session,Adolescents and Media: Working Toward Adulthood,Children Adolescents and the Media,Adolescents’ Social Reading: Motivation; Applying the Theory of Planned Behavior to Adolescents’ Acceptance of Online Friendship Requests Sent by Online Strangers - Wannes Heirman; Beyond the Lab: Investigating Early Adolescents’ Cognitive; Exploring the Associations Across Adolescence of Perceived Desirability for Alcohol Advertising and Skepticism About Advertising - Erica Weintraub Austin; MTV Reality Shows and Adolescents’ Intentions Towards Smoking and Alcohol Use: BIS/BAS and Social Norms - Jolien Vangeel; Social Network Site Uses; Stop or Go? Playing Violent Computer Games Impairs Self Control in Adolescents - Ewa Miedzobrodzka; The Role of Communication and Rumors in Adolescents' Perceptions and Behaviors Regarding Sociopolitical Issues: A Heuristic-Systematic Model - Jae Seon Jeong; This is Advertising! Effects of Disclosing Television Brand Placement on Adolescents - Eva van Reijmersdal,Behavior and Their Relationship - WU LI; U of Antwerp - Department of Communication Studies; Anne Vermeulen; Emotional; Washington State U; Adrienne Fayola Muldrow; U of Leuven - School for Mass Communication Research; Nancy Rhodes; Friendship Networks; Vrije Universiteit Amsterdam; Fredrick Waiyaki; Hallym University; Seungyoon Lee; U of Amsterdam; Sophie Carolien Boerman
Paper Session,CAT Hybrid Session 5: Global Perspectives on Technology,Communication and Technology,,
Paper Session,Not So Easy: Problematic Aspects of Digital Games,Game Studies,,
Paper Session,Health Risk Perception and Behaviors,Health Communication,,
Paper Session,Digital Exclusion and Inequality,Communication and Technology,,
Paper Session,LGBTQ Health Communication,Health Communication,,
Paper Session,Online Health Information and Behavioral Intentions,Communication and Technology,,
Paper Session,Competitive Papers in Global Media and Culture,Global Communication and Social Change,,
Paper Session,The Study of Emotion in Relation to News,Mass Communication,,
Paper Session,News and the Active Audience,Mass Communication,,
Paper Session,Public Opinion Research in the Digital Era,Political Communication,,
Paper Session,Global Film: Culture and Conflict,Popular Communication,,
Paper Session,Communicating Organizations: Strategic and Constitutive Communication,Organizational Communication,,
Paper Session,Emotions and Beliefs: The Power of Internal Forces in the Classroom,Instructional & Developmental Communication,,
Paper Session,"Communicative Practices to Construct Reasonableness Standards, Responsibilization, Common Ground, and Relationship Bond",Language & Social Interaction,,
Paper Session,"Media, Marketing, and Children's Health",Children Adolescents and the Media,How Candy Placements in Films Influence Children`s Selection Behavior in Real-Life Shopping Scenarios - Maren Beaufort; Using New Media Technologies to Improve Eating and Exercise Behaviors via a Health Intervention Program - Kimberly Bissell; Mobile Marketing to Children: A Content Analysis of Food and Beverage Company Apps - Lisa B. Hurwitz; Heavy Childhood TV Use Persists Into Adulthood and is Associated With Increased BMI - Chance York,Austrian Academy of Sciences - Institute for Comparative Media and Communication Studies; U of Alabama; Xueying Zhang; Northwestern University; Eric Morales; Kent State University
Paper Session,B.E.S.T.: Social and Collaborative Technologies in Organizational Communication,Organizational Communication,,
Paper Session,CAM Research Escalator Session 1,Children Adolescents and the Media,Mapping the Invisible and Exploring Connections Between Young People; Effects From Smoking-Related Media Messages on Chinese Adolescent Smoking: Testing the Mediating Role of Perceived Descriptive Peer Norm - Chun Zhou; The Power of Social Media Influencers: A Study of the Use of Influencers by Brands to Communicate With Adolescent Consumers - Amy Jo Struthers; Mobile Phone Use and the Changing Values of the Young Igorot - Dazzelyn Baltazar Zapata; Presenting Ourselves Into Being: Exploring Social Media Use and Self-Concept Change for Adolescents - Sarah Rose Marcus; Understanding the Web Use Behavior of Our Youngest Internet Audience - Fashina Alade; Tethered Toddler,Technology; University of Miami; U of Nebraska–Lincoln; National U of Singapore; Rutgers; Northwestern University; Distracted Toddler? Linking Preschoolers’ Attention-Deficiency to Task-Switching and Extraneous Problem-Solving When using tablets - Stephanie Van Hove
Paper Session,Theorizing Journalism,Journalism Studies,,
Paper Session,Advertising and Privacy,Communication and Technology,,
Paper Session,"Sexual Health Communication: Consent, Pledges, Safe Sex, Contraceptives",Health Communication,,
Paper Session,News and Social Media,Communication and Technology,,
Paper Session,Journalism as Practice: Values and Perceptions,Journalism Studies,,
Paper Session,Methodological Advances in Mass Communication Research,Mass Communication,,
Paper Session,"Politicized Communication: Movements, Ideology, and Modernity",Communication History,,
Paper Session,Textual Analyses in Mass Communication Research,Mass Communication,,
Paper Session,"Citizenship, Community, and Civic Engagement",Political Communication,,
Paper Session,Top Papers in Intercultural Communication,Intercultural Communication,,
Paper Session,Forms of Power: Public Diplomacy and Government Relations,Public Relations,,
Paper Session,Industry Change and Accommodation,Media Industry Studies,,
Paper Session,Governing Free Speech and Information in the 21st Century,Communication Law & Policy,,
Paper Session,Race and Ethnicity Across Learning Environments,Ethnicity and Race in Communication,,
Paper Session,Information and Perceptions of Out Groups: Between Empathy and Conflict,Political Communication,,
Paper Session,Mediated Close Relationships: Interpersonal Communication Online,Interpersonal Communication,,
Paper Session,Best Papers in Information Systems Division,Information Systems,,
Paper Session,"CAT Hybrid Session 1: ICTs, Divides, and Privacy",Communication and Technology,,
Paper Session,CAM Research Escalator Session 2,Children Adolescents and the Media,(Il)legal File Sharing; Could Interpersonal Communication be the Missing Link in Elimination Mother-to-Child Transmission of HIV ?: The Impact of the Mentor Mother Programme in Homa Bay Kenya on Pregnant Women Living With HIV - Evonne Mwangale Kiptinness; Crazy Cyber World: Construction of a Composite Index for Measuring Child Online Protection (COPI) - Ada Sonia Peter; Leave Them Kids Alone: Children-Related Images Management and Adult Power in Web-Based Communicative Practices - diana salzano; Media Education: Core; Parent Engagement and New Media Communication Technologies in the Los Angeles Unified School District (LAUSD) - Brandon Golob; Power of Media: Exploring the Indirect Effects of Media on Genetic Testing Among Hispanic/Latino Children - Jessica E Wendorf; The Internet as a Sex Education Resource for Lebanese Adolescents: Its Impact on Attitude and Intended Sexual Behaviors - Danijela Savaya,Downloading; Daystar University; Covenant University; Tolulope kayode-adedeji; U of Salerno; antonella napoli; Boundaries; U of Southern California - Annenberg School for Communication; University of Miami; Fan Yang; Notre Dame University; Jessica El-Khoury
Paper Session,Top Papers in Health Communication,Health Communication,,
Paper Session,"Social Media, Discussion, Deliberation, and Public Opinion",Communication and Technology,,
Paper Session,Ethnicity & Race Across Eurasia,Ethnicity and Race in Communication,,
Paper Session,"Media Technology Industries: Online Journalism, On-Demand, and Streaming Services",Communication and Technology,,
Paper Session,"Language Use in Small Claims Court, Public Meetings, Consultations for Over-the-Counter Medicines, and Health Information Consumers' Online Comments",Language & Social Interaction,,
Paper Session,Social Media and Cultural Adaptation,Intercultural Communication,,
Paper Session,Top Papers in Global Communication and Social Change,Global Communication and Social Change,,
Paper Session,Advancing Theory Building in Mass Communication Research,Mass Communication,,
Paper Session,"Selective Visuals: Politics, Metaphors, Narratives",Visual Communication Studies,,
Paper Session,Instructional and Developmental Top Paper Panel,Instructional & Developmental Communication,,
Paper Session,Strategies and Tactics in Popular Politics,Popular Communication,,
Paper Session,Communicating With Power: Stakeholders and Corporations,Public Relations,,
Paper Session,Top Papers in Organizational Communication,Organizational Communication,,
Paper Session,"Extended Session: LGBTQ Europe, US, and Networks","Lesbian, Gay, Bisexual, Transgender and Queer Studies",,
Paper Session,For the Greater Good: New Approaches in Serious Games,Game Studies,,
Paper Session,"Parenting, Family Communication, and Child Outcomes",Interpersonal Communication,,
Paper Session,"Journalistic Roles: Perception, Performance, Identity",Journalism Studies,,
Paper Session,Using Big Data to Examine Science Communication and Research Communties,Communication and Technology,,
Paper Session,Communication Infrastructure and the Social Shaping of Technology,Communication and Technology,,
Paper Session,Smartphones (High-Density),Mobile Communication,,
Paper Session,Top Student Papers in Public Relations,Public Relations,,
Paper Session,"Ideas, Power, and Accountability in Media Policy",Communication Law & Policy,,
Paper Session,CAT Hybrid Session 2: Virtual Experiences and Interaction,Communication and Technology,,
Paper Session,Online Comments and the News,Journalism Studies,,
Paper Session,Health Communication Advertising and Advertisements,Health Communication,,
Paper Session,Selfies and Self-Presentation Online,Communication and Technology,,
Paper Session,"College Health Promotion: Drinking, Substance Abuse, Sexual Assault",Health Communication,,
Paper Session,Self-Disclosure and Privacy in Social Media,Communication and Technology,,
Paper Session,Covering Science and Health,Journalism Studies,,
Paper Session,Cultural Influence on Advertising and Corporate Communication,Intercultural Communication,,
Paper Session,What Generates News Content? (TOP STUDENT PAPER),Mass Communication,,
Paper Session,Protecting Water and Air: Examining Communication and Decision-Making Practices,Environmental Communication,,
Paper Session,Communication in Online Relationships: Is the Medium the Relationship?,Interpersonal Communication,,
Paper Session,Understanding Online Political Participation,Political Communication,,
Paper Session,"Contexts, Processes, and Outcomes of Outgroup Attitudes and Intergroup Contact",Intergroup Communication,,
Paper Session,The Visual Communication of Identities and Values Across Cultures,Visual Communication Studies,Communicating Eternal Love and Confucian Values via Visual and Cultural Images of Korean Historical Television Dramas - Carolyn A. Lin; Complicating Visual Identities Post 9/11: Muslim Female YouTubers Speak Back - Diane Watt; Looking Through Outdoor Advertising Images for Beauty in Argentina; Utopia,U of Connecticut; SUJI PARK; University of Ottawa; Chile; Nostalgia
Paper Session,Media & Democracy: Press Freedom and Censorship,Political Communication,,
Paper Session,Antismoking/Antidrinking: High Density Panel in Health Communication,Health Communication,,
Paper Session,Work-Life Balance and Flexible Work,Organizational Communication,,
Paper Session,"Robots, Machines, and Algorithms: Perspectives on Automated Journalism",Journalism Studies,,
Paper Session,"Culture and Social Interaction: Language, Identity, Community, and Intercultural Communication",Language & Social Interaction,,
Paper Session,Communication and Technology Division Top Student Papers,Communication and Technology,,
Paper Session,The Power of Technology for Learning,Instructional & Developmental Communication,,
Paper Session,"Social Media, Political Mobilization, and Participation",Communication and Technology,,
Paper Session,Mass Communication Research at the Systems Level (TOP STUDENT PAPER),Mass Communication,,
Paper Session,Media Industry Studies Business Meeting,Media Industry Studies,,
Paper Session,"News Exposure and Effects: Knowledge, Interest, and Behavior",Political Communication,,
Paper Session,"Music, Sound, and Popular Culture",Popular Communication,,
Paper Session,"Perception, Cognition, and Experience in Visual Communication Research",Visual Communication Studies,,
Paper Session,Online Social Capital,Communication and Technology,,
Paper Session,Top Papers in Sports Communication,Sports Communication,,
Paper Session,Political News in Comparative Perspective,Political Communication,,
Paper Session,Extended Session: Parental Mediation,Children Adolescents and the Media,A Matter of Style? The Differential Effects of Parental Mediation on Early Adolescents’ Media Violence Exposure and Aggression - Karin Fikkers; Children’s Attitudinal and Behavioral Reactions to Product Placements: Do Parental Mediations and Family Conversations Matter? - Brigitte Naderer; Game On: Refining the Parental Mediation Framework for a Video-Gaming Landscape - Hee Jhee Jiow; Reversed Parental Television Mediation: Children’s Guidance of Their Parents’ Television Use and Parent-Child Television Conflict. - Sara Nelissen; The Role of Parents on Children's Media Use: A Meta-Analysis of Parental Mediation - Liang Chen; Using Moral Foundations Theory and Parent Mediation to Understand the Effect of Child Exposure to Televised Moral Lessons on Transfer to Moral Situations - Drew Cingel; Guiding Young Children’s Digital Media Use: Concerns and Competences Among Parents From Different Socioeconomic Backgrounds - Peter Nikken; Parents and TV as Socializers of 6- to 19-Year-Olds' Expressions of Emotion: Representative Data From Germany - Sebastian Scherr; Rules; Social Networking Sites and Materialism: Safeguarding Roles of Parents and Personal Traits - Hillbun Ho,ASCoR; U of Vienna; Franziska Marquart; Singapore Institute of Technology; Sun Sun Lim; U of Leuven - School for Mass Communication Research; Jan Van den Bulck; Nanyang Technological University; University of California -- Davis; Marina Krcmar; Megan K. Olsen; Netherlands Youth Institute/Erasmus University Rotterdam; LMU Munich; Marie-Louise Mares; Role Model; Nanyang Technological University; Wonsun Shin
Paper Session,On the Technical Side of Digital Games,Game Studies,,
Paper Session,B.E.S.T.: Social Responsibility and Ethics in Communication Practice and Research,Organizational Communication,,
Paper Session,The Power of CSR in Times of Crisis,Public Relations,,
Paper Session,Disrupting Journalism: Challenging Key Concepts in Journalism Studies,Journalism Studies,,
Paper Session,Social Network Studies in Health Communication,Health Communication,,
Paper Session,Emotion and Information Processing,Communication and Technology,,
Paper Session,"Cross-Cultural studies on Family, Marriage, and Romantic Relationships",Intercultural Communication,,
Paper Session,"Communicating Nature, Sustainability, and Environmental Issues Using Online Media Channels",Environmental Communication,,
Paper Session,"Media, Sex, and Porn (TOP FACULTY PAPER)",Mass Communication,,
Paper Session,Messaging Apps and Mobile Social Media (High-Density),Mobile Communication,,
Paper Session,Political Discussion and Deliberation: Theoretical and Methodological Issues,Political Communication,,
Paper Session,Interpersonal Communication and Health,Interpersonal Communication,,
Paper Session,Top Student Papers in ERIC,Ethnicity and Race in Communication,,
Paper Session,"Perceptions and Effects of Messages: Group-Based Identity in Media, Mediated, and Health Communication",Intergroup Communication,,
Paper Session,Election Debates: Exposure and Effects,Political Communication,,
Paper Session,Negative Effects of Social Media,Communication and Technology,,
Paper Session,Experimental Message Design in Health,Health Communication,,
Paper Session,Smartphone Studies,Communication and Technology,,
Paper Session,"Intergroup Contact, Communication Apprehension, and Cultural Adjustment",Intercultural Communication,,
Paper Session,Public Opinion of Environmental Issues and Controversial Science,Environmental Communication,,
Paper Session,Audience Engagement With News (TOP FACULTY PAPER AWARDEE),Mass Communication,,
Paper Session,Social Media and Technology as New Playgrounds: Hashtags and Beyond,Feminist Scholarship,If “Diversity” is the Answer; “You Can Start a Movement With a Hashtag”: An Exploration of Student-Led Social Media Activism - Candace P Parrish; DIY Feminism: Making the Personal Political - A Work-in-Progress - Rosemary Clark; Feminist Uses of Social Media - Stine Eckert; (Still) Making the Personal Political: #YesAllWomen,What is the Question? Understanding Diversity Advocacy in Amateur Technology Projects - Christina Dunbar-Hester; Virginia Commonwealth University; Rowena Lyn Briones; The Annenberg School for Communication at the University of Pennsylvania; Wayne State University; Linda C. Steiner; Digital Feminism
Paper Session,"Extended Session: Let Me Entertain You! Digital Games, Driving Forces, and Experience",Game Studies,,
Paper Session,News Approaches to Election Campaigns and Voting Behavior,Political Communication,,
Paper Session,The Power of Crisis Management: Understanding the Role of Public Relations,Public Relations,,
Paper Session,Current Approaches to Photography's Changing Ontologies,Visual Communication Studies,,
Paper Session,Consuming Media,Media Industry Studies,,
Paper Session,Revisiting the Controversies: Histories of Communication Study,Communication History,,
Paper Session,Journalism and Social Media,Journalism Studies,Journalistic Branding on Twitter: An Exploratory Study of Australian Journalists - Folker Christian Hanusch; When Citizens and Journalists Interact on Twitter Effects Over Journalists’ Performance Expectations and Media-Bias Perceptions - Homero Gil de Zuniga; Agenda-Building and Journalists’ Use of Political Tweets: From Information Subsidies to Perceived Influences - Julia Metag; The Varied Effects of Seeing Journalists on Social Media: An Assessment of Self-Disclosure,Queensland U of Technology; Axel Bruns; University of Vienna; Trevor H Diehl; University of Zurich; Adrian Rauchfleisch; Perceived Objectivity
Paper Session,Antismoking Health Messages,Health Communication,,
Paper Session,"Virtual Reality, Presence, and the Effects of Technology",Communication and Technology,,
Paper Session,Studies of Media Effects and Health,Health Communication,,
Paper Session,Loneliness and Displacement on the Internet,Communication and Technology,,
Paper Session,Media-Related Health Communication Research (TOP FACULTY AND STUDENT PAPER),Mass Communication,,
Paper Session,Political Leaders and the Media,Political Communication,,
Paper Session,mHealth,Mobile Communication,,
Paper Session,Leadership in Organizational Communication,Organizational Communication,,
Paper Session,"Problematic Interactions: Arguments, Advice, and Other Contentious Issues in Interpersonal Relationships",Interpersonal Communication,,
